project,task_id,response,assessment,reqid,project_id,project_name
,654e6eb59776be9af16f481f,"""Session Initiation Protocol (SIP) is a signaling protocol used for establishing, modifying, and terminating multimedia sessions over IP networks. SIP plays a vital role in enabling real-time communication applications such as voice and video calls, instant messaging, and multimedia conferences. In this answer, we will discuss the steps involved in establishing a call between a caller and a callee using SIP.\n\n1.  **Find the callee's SIP address:** Identify the callee's unique identifier on the SIP network, which is their SIP address.\n2.  **Send an INVITE message:** The caller sends an INVITE message to the callee's SIP address, indicating their intention to start a call.\n3.  **Route the INVITE request:** The INVITE message passes through SIP proxy servers to reach the callee's SIP client.\n4.  **Receive a response from the callee:** The callee accepts or rejects the call by sending a response to the caller.\n5.  **Negotiate session parameters:** The caller and callee exchange information about their media capabilities and agree on session parameters.\n6.  **Exchange media streams:** Real-time communication starts by exchanging media streams using agreed-upon codecs and protocols.\n7.  **End the call:** Either party sends a BYE message to indicate the call's termination, and media streams are closed.\n\n**Final answer:** SIP is a signaling protocol that facilitates the establishment, modification, and termination of multimedia sessions over IP networks. It plays a crucial role in enabling real-time communication applications such as voice and video calls, instant messaging, and multimedia conferences.\n""",No Error,clp0pl7kb04k91as3a1ms8ouk,65414db2dc8e65e4dfe4963c,Computer Science Single Turn
,654e6ea4705fe06734d1e1ed,"""import java.util.\\*;\n\n\n\npublic class TopKFrequentElements {\n\n    public static int\\[] topKFrequent(int\\[] nums, int k) {\n\n        Map\\<Integer, Integer> frequencyMap = new HashMap<>();\n\n        int\\[] result = new int\\[k];\n\n        for (int i = 0; i < k; i++) {\n\n            result\\[i] = pq.poll();\n\n        }\n\n        return result;\n\n    }\n\n    public static void main(String\\[] args) {\n\n        // Example usage\n\n        int\\[] nums = {1, 1, 1, 2, 2, 3};\n\n        int k = 2;\n\n        // Get the top k frequent elements\n\n        int\\[] result = topKFrequent(nums, k);\n\n        // Print the result\n\n        System.out.println(Arrays.toString(result)); // Output: \\[1, 2]\n\n    }\n\n}\n\nExplanation:\n\n\\- The \\`TopKFrequentElements\\` class has a method \\`topKFrequent\\` that utilizes a HashMap to count element frequencies.\n\n\\- A PriorityQueue is employed to store the top k elements, with a custom comparator based on frequencies.\n\n\\- The main method demonstrates the usage of \\`topKFrequent\\` with a sample input array, and the result is printed.\n\n\\- The time complexity is O(n log k) due to PriorityQueue usage, and the space complexity is O(n) due to the HashMap.\n\n\n\nFinal answer: The provided code implements a solution to find the top k frequent elements in an integer array using a HashMap and a PriorityQueue. \n""","Error: ""A PriorityQueue is employed to store the top k elements, with a custom comparator based on frequencies."" The provided code",clp0pl89v01xz1asaf2jv5zt7,65414db2dc8e65e4dfe4963c,Computer Science Single Turn
,6542ea4d7c823bbfa0b64e85,"""**Improved answer:**\n\nYes, the given statement is true.\n\nA Hidden Markov Model (HMM) is an extension of a Markov chain that can consider previous and current states to predict the future state. Unlike traditional Markov chains, which only consider the current state to determine the future state, an HMM introduces hidden states that are not directly observable. These hidden states are determined by the Markov assumption, which states that the probability of being in a particular state depends on the previous hidden state.\n\nTo illustrate this, let's consider an example of an HMM that can be used to model a speech recognition system. The hidden states in this HMM represent different phonemes (sounds) that can be combined to form words. The observable states represent the words that can be recognized by the system. The transition probabilities between the hidden states are determined by the Markov assumption, which states that the probability of moving from one phoneme to another depends on the previous phoneme.\n\nFor example, if we want to recognize the word \""cat,\"" the HMM would start in the initial state (which represents the silence before the word is spoken). As the speaker speaks, the HMM transitions through the hidden states, each representing a different phoneme. The probability of transitioning from one phoneme to another is determined by the transition probabilities in the HMM. Finally, the HMM reaches the observable state representing the word \""cat,\"" which indicates that the system has recognized the word.\n\nFinal answer: HMMs are an extension of Markov chains that can consider previous and current states to predict the future state. They are particularly useful in applications where the underlying process is not directly observable, such as speech recognition or natural language processing.\n""",No Error,clp0pl9ev04kh1as34wnd4jk6,65414db2dc8e65e4dfe4963c,Computer Science Single Turn
,6542ea4d74cef434529497af,"""Big data refers to the large and complex sets of data that organizations and businesses collect and analyze to gain insights and make informed decisions. Many businesses across various industries use big data to improve their operations, customer experience, and decision-making processes.\n\nSome examples of businesses that use big data include:\n\n*   **E-commerce giants:** Comanies like Amazon and Alibaba leverage Big Data for personalized recommendations, inventory management, and targeted marketing.\n*   **Social media platforms:** Facebook, Twitter, and Instagram analyze vast amounts of user data for content personalization, ad targeting, and trend analysis.\n*   **Financial institutions**: Banks and investment firms use Big Data for fraud detection, risk assessment, disease prediction, and drug discovery.\n*   **Retail chains:** Brick-and mortar stores use Big Data for demand forecasting, inventory optimization, and customer experience enhancement.\n*   **Telecommunication companies:** Providers analyze call records, customer interactions, and network performance for better service quality and resource optimization.\n\nThese businesses collect and analyze data from various sources, such as customer transactions, website interactions, social media, and IoT devices. They use big data technologies like Hadoop, Spark, and NoSQL databases to store, process, and analyze the data.\n\nIn conclusion, big data is a powerful tool that businesses can use to improve their operations, customer experiences, and decision-making processes. By leveraging big data technologies and analyzing data from various sources, businesses can gain valuable insights and make informed decisions that drive growth and profitability.\n\nFinal answer: Big data is a valuable tool for businesses across various industries, providing them with insights and information to optimize their operations, customer experiences, and decision-making processes. Examples of businesses that use big data include retail giants, technology companies, financial institutions, healthcare organizations, and social media platforms.\n""","Error: ""Financial institutions: Banks and investment firms use Big Data for fraud detection, risk assessment, disease prediction, and drug",clp0pla0d04av1aqg664hakk0,65414db2dc8e65e4dfe4963c,Computer Science Single Turn
,654e6ecf979d33d575b828cd,"""AllJoyn is an open-source framework that enables interoperability between certified devices, allowing them to discover and communicate with each other. Developed by the Allseen Alliance (now part of the Open Connectivity Foundation), AllJoyn aims to provide a universal software framework that allows devices and apps to discover and communicate with each other seamlessly regardless of their operating system or manufacturer . By providing a set of system services, AllJoyn facilitates device interoperability, enabling them to work together efficiently and effectively.\n\nWhile AllJoyn focuses on interoperability, it does not address aspects such as speed performance, reliability, and encryption compliance. Therefore, the correct answer is option 2 i.e. Interoperability.\n\nFinal answer: AllJoyn is a framework that enables interoperability between certified devices, providing a universal software framework for devices and apps to communicate and work together efficiently.\n""",No Error,clp0plbo804b11aqg2aye1bv6,65414db2dc8e65e4dfe4963c,Computer Science Single Turn
,654e6ead4e9a41098dcb649b,"""**Improved answer:**\n\nA privacy policy is a critical component of any e-commerce platform, as it establishes a relationship of trust between the platform and its users. By outlining how personal data is collected, stored, and used, a privacy policy provides transparency and empowers users to make informed decisions about their personal information.\n\n1.  **Data Collection:** A privacy policy clarifies how an e-commerce platform gathers, stores, and uses user data, ensuring transparency on the purpose and extent of data collection.\n\n    *Example:* \""When you sign up, we need your name and address for deliveries and your payment details to process transactions securely.\""\n2.  **User Consent:** The privacy policy informs users about data usage, allowing them to make informed decisions and provide or withhold consent, crucial in regions with data protection laws like GDPR.\n\n    *Example:* \""By checking the box, you're agreeing to let us use your information for order processing and managing your account.\""\n3.  **Data Protection Laws:** Privacy policies ensure compliance with data protection laws, compelling platforms to safeguard user data, provide access upon request, and implement necessary security measures to avoid legal consequences.\n\n    *Example:* \""We follow data protection laws to keep your information safe. We use encryption, conduct security checks, and have a dedicated team to protect your data.\""\n4.  **Trust and Transparency:** Privacy policies build trust by transparently communicating how user data is handled, showcasing the platform's commitment to privacy and encouraging user confidence in responsible data management.\n\n    *Example:* \""We're committed to your privacy. Check out our Privacy Policy for clear details on how we use your data and the steps we take to keep it secure.\""\n5.  **Third-Party Services:** Privacy policies disclose relationships with third-party services, notifying users of potential access to personal information, enhancing transparency about external involvements.\n\n    *Example:* \""We use trusted partners for secure transactions. Our Privacy Policy explains this, ensuring you know about third-party involvement.\""\n6.  **Marketing and Communication:** Privacy policies inform users about the platform's use of personal data for marketing purposes, offering choices to opt in or out of communications and assuring users against unauthorized data sharing.\n\n    *Example:* \""During sign-up, you can choose to receive our newsletter with exclusive offers. Opt-out anytime, and we won't share your data for unrelated marketing.\""\n7.  **User Rights:** Privacy policies outline user rights regarding personal data, empowering them to access, correct, or delete information and take action if they believe their privacy rights have been violated.\n\n    *Example:* \""You have the right to access, correct, or delete your data. Contact us if you want to manage your information or if you have any privacy concerns.\""\n\nFinal answer: These generic examples aim to maintain a direct and user-focused tone, emphasizing clarity and simplicity in communication for an e-commerce platform's privacy practices.\n""",No Error,clp0plcar00mf1aty1vlafb1o,65414db2dc8e65e4dfe4963c,Computer Science Single Turn
,654e6eca979d33d575b82665,"""```python\ndef primes_count(numbers):\n\n```\n\nThe above function uses a more concise and efficient approach to count the number of prime numbers in a given list. It uses a for loop to iterate over the numbers in the list, and a nested for loop to check if a number is prime. The nested loop runs from 2 to the square root of the number, and checks if the number is divisible by any of the numbers in that range. If the number is not divisible, it means it is prime, and the count is incremented.\n\nThe function returns the count of prime numbers in the list.\n\nHere is a sample to run this program and its output:\n\n```python\nnumbers = [3, 10, 11, 45, 33, 23, 8, 6]\n```\n\nOutput: 3\n\n**Final answer:** The above function is a more efficient and concise way to count the number of prime numbers in a given list. It uses a nested loop to check if a number is prime, and returns the count of prime numbers.\n""",No Error,clp0plcxq00ez1aro8znk82uu,65414db2dc8e65e4dfe4963c,Computer Science Single Turn
,654e6ecbdd9cb38a62f0c971,"""**Improved answer:**\n\n The decoder input is the 4 most significant bits of the 32-bit address, and the output is the selection of one of the 16 memory banks.\n\nTo find the range of addresses for the first bank, we need to examine the decoder output for each possible input. The decoder output for the first bank is 00000000-0fffffff. This means that the first bank is selected when the decoder input is 0000.\n\n\n\nFinal answer: The range of addresses that comprise the first/lowest bank is 00000000-0fffffff.\n""",No Error,clp0pldhn02lm1as6dwd41y15,65414db2dc8e65e4dfe4963c,Computer Science Single Turn
,654e6ed41e83cc4c1e372e0b,"""*   The correct answer is option c, Skype users find the address of a remote party through peer-to-peer. Skype uses a peer-to-peer architecture to connect users, which means that each user's computer acts as a node in the network and communicates directly with other nodes to establish connections. When a user initiates a call, Skype's algorithm searches for the best path to connect the two parties through a series of distributed nodes, also known as \""supernodes.\"" These supernodes act as directories, storing information about the online status and IP addresses of other users. Once the connection is established, the call is routed through the nodes, ensuring that the communication remains decentralized and peer-to-peer.\n*   Final answer: Skype uses a peer-to-peer architecture to connect users, where each user's computer acts as a node in the network and communicates directly with other nodes to establish connections. Therefore, option c, Skype users find the address of a remote party through peer-to-peer, is the correct answer..\n\n""",No Error,clp0ple3j00351aqh1n7m4dwk,65414db2dc8e65e4dfe4963c,Computer Science Single Turn
,654e6ed3dd9cb38a62f0cfb6,"""To close a child window after opening it, the parent window's JavaScript code must include a variable containing the child window reference in order to call the close() method on it. This is achieved by storing the child window object in a variable when opening the child window, as shown in the following example:\n\nvar childWindow = window\\.open('child.html', 'Child Window');\n\nThe correct answer is **a variable containing the child window reference in order to call close()**.\n\nWhen a parent window opens a child window using JavaScript's \\`window\\.open()\\` method, the child window is assigned a unique reference. This reference can be used to access and manipulate the child window from the parent window. To close the child window, the parent window can call the \\`close()\\` method on the child window reference.\n\n\n\nThe other options are incorrect because:\n\n\n\nPassing JavaScript code to the child window to tell it to close itself is a less common and potentially less secure approach.\n\n\n\nParent windows can indeed close child windows, and the `close()` method is the standard way to do so.\n\n\n\nSetting the `\""closeWindow\""` attribute on the child window HTML is not a valid HTML attribute.\n\n\n\nTherefore, the only reliable and efficient way to close a child window from the parent window is to store the child window reference in a variable and call the `close()` method on that reference.\n\nFinal answer: The correct answer is a) a variable containing the child window reference in order to call close(), as it's the only reliable way to close a child window from the parent window's Javascript code.\n""",No Error,clp0pleuj00gq1apmakxvc6d8,65414db2dc8e65e4dfe4963c,Computer Science Single Turn
,6542ea3f3478c1f6a1055c30,"""Let's understand the terms separately at first.\n\n*   **Architectural patterns** and **tactics** are intimately related in software design. \n*   **Architectural patterns** describe the high-level structure and behavior of a software system, providing a solution to multiple system requirements. \n*   **Tactics**, on the other hand, are specific design decisions that have a significant impact on the architecture of a system. **Tactics** are implemented in the existing architecture and are used to improve quality attribute concerns.\n\n### *Relationship between architectural patterns and tactics :*\n\n*   The relationship between architectural patterns and tactics is a hierarchical one. \n*   Architectural patterns provide a framework for making tactical decisions, and tactics are the building blocks that help realize the patterns.\n*    In other words, tactics are the means by which architectural patterns are implemented and realized.\n\nFor **example**, the **architectural pattern** of a layered architecture can be implemented using various **tactics such as using APIs**, **messaging queues,** or **service registries** to communicate between layers.\n\nSimilarly, the architectural pattern of a microservices architecture can be implemented using tactics such as containerization, service discovery, and circuit breakers.\n\n***Final answer:*** The relationship between **architectural patterns** and **tactics** is a **hierarchical one**, where architectural patterns **provide the framework for making tactical decisions**, and **tactics** **are the building blocks that help realize the patterns** and address quality attribute concerns.\n""",No Error,clp0plffj00f51aro8fipab72,65414db2dc8e65e4dfe4963c,Computer Science Single Turn
,6542ea3ee3a666094cc5e408,"""The answer to your question will be B. m.\nLinear probing is a collision resolution technique used in hash tables, where we use a single probe sequence to search for an empty slot in the table. The number of potential probe sequences is equal to the number of entries in the table, which is m.\n\n**To explain this, suppose we have a hash table with m slots. Each slot can be the start of a potential probe sequence, which can be any sequence of m slots. Hence, the number of potential probe sequences is m.** \n\nFor instance, if we have a hash table with 5 entries, the potential probe sequences would be:\n\n1.  **ABCDE**\n2.  **ACDBE**\n3.  **AECDB**\n4.  **BACDE**\n5.  **BCADE**\n\nAs we can see, there are 5 potential probe sequences for a hash table with 5 entries. Likewise will be the case in your question.\n\nFinal answer: **The number of potential probe sequences when using linear probing with a table with m entries is m, which is option B.**\n""","Error: ""The number of potential probe sequences is equal to the number of entries in the table, which is m.""",clp0plg9401y51asafc2g6w0z,65414db2dc8e65e4dfe4963c,Computer Science Single Turn
,6542ea488e12c0a44923f2e5,"""When importing data into a database or a data management system, it is crucial to understand where the data can be appropriately stored. There are several options available, but there are also limitations that need to be considered. \n\n\n\nOne key limitation is that data cannot be stored in a new form. Forms, in the context of data management, are typically used for data entry or display not for data storage. Therefore while you can use forms to input or view data, they are not a storage medium for imported data. \n\n\n\nInstead imported data is generally stored in the following ways:\n\n*   Linked Table : A linked table is a reference to a table in another database. It allows for easy access and manipulation of the data in the linked table as if it were part of current database.\n*   Existing table: The data can be imported and saved in an existing table, which can be renamed later. This will keep the data as appended information. \n*   A new table can be used to store the imported data, and it can be named later\n\n\n\nIt's important to note that the data being imported can be in various formats, such as boolean, string, integer, etc. and it can also be an address.\n\n\n\nFinal answer: When importing data, the feasible storage options include linked tables, existing tables or new tables. Data cannot be directly stored in a new form. Forms are used for data entry and display. The choice of storage method depends on the nature of the imported data and the database system's requirements\n\n""",No Error,clp0plhla01xd1aqi0stuc2tw,65414db2dc8e65e4dfe4963c,Computer Science Single Turn
,6542ea455934898e6c51e1d4,"""**Improved answer:**\n\nThe given rule for the paragraph tag <p> is:\np {margin-top: 15px; margin-bottom: 10px;}\n\nTo calculate the size of the vertical margins between paragraphs, we need to apply the rule for collapsing margins. The formula for calculating the vertical margin is:\nvertical margin = max(top margin, bottom margin)\n\nSo, the size of the vertical margins between paragraphs is 15px.\n\nFinal answer: The size of the vertical margins between paragraphs for the given margin-top and margin-bottom is 15px.\n\nIn summary, the improved answer provides a step-by-step explanation of the calculation, correctly states the bottom margin as 10px, and includes a final summary of the answer. The answer is complete, accurate, and well-structured, with a QC score of 4.5.\n""",No Error,clp0pli9n004q1apghxxg9nzt,65414db2dc8e65e4dfe4963c,Computer Science Single Turn
,654e6ea8979d33d575b81ddc,"""Public IP addresses and private IP addresses are two types of network addresses used to identify devices within a network. While they share some similarities, they have distinct differences in terms of their functionality, accessibility, and usage.\n\n\n\n### **Public IP Addresses:**\n\nA public IP address is globally unique and is assigned by an Internet Service Provider (ISP) to a device directly connected to the Internet. It serves as the identifier for a specific device or network on the public internet, enabling direct accessibility from anywhere. Public IP addresses are limited and allocated by regional internet registries to ISPs. Examples include IPv4 addresses like 203.0.113.45 or IPv6 addresses like 2001:0db8:85a3:0000:0000:8a2e:0370:7334. They are instrumental in hosting public services or applications accessible from the internet, such as web servers, email servers, or game servers.\n\n### **Private IP addresses:**\n\nPrivate IP addresses are assigned to devices within a private network, such as a local area network (LAN) or a home network. They are not globally unique and cannot be directly accessed from the internet. Private IP addresses are used for internal communication within a network and are not routable on the internet. They are commonly used to connect devices within a home, office, or organization. Private IP addresses are defined by specific ranges reserved for private networks, such as the commonly used ranges:\n\nIPv4: 10.0.0.0 to 10.255.255.255, 172.16.0.0 to 172.31.255.255, 192.168.0.0 to 192.168.255.255\nIPv6: fc00::/7 (ULA addresses)\n\nWhen it comes to choosing between a public IP address and a private IP address, it's important to consider the specific needs of the network and the devices connected to it. Public IP addresses are appropriate for hosting public services or applications that need to be accessible from the internet, such as web servers, email servers, or game servers. They are also useful for establishing direct communication with devices or networks on the internet, such as establishing a Virtual Private Network (VPN) connection.\n\n### **Appropriate Circumstances:**\n\n**Public IP Address Usage:**\n\n*   Hosting public services like web servers, email servers, or game servers.\n*   Direct communication with devices or networks on the internet, such as establishing VPN connections.\n\n**Private IP Address Usage:**\n\n*   Setting up local networks within homes or offices for internal communication.\n*   Establishing secure network environments using NAT routers or firewalls.\n*   Configuring VPNs or remote access connections within an organization.\n\n\n\n### **Final Answer:**\n\nBoth public and private IP addresses are implemented according to the particular needs of providing public services, facilitating international communication, or creating safe local networks, demonstrating their unique features within the networking domain.\n""",No Error,clp0plirx04b81aqg9vwkf7om,65414db2dc8e65e4dfe4963c,Computer Science Single Turn
