project,task_id,response,assessment,reqid,project_id,project_name
,654e6ed7705fe06734d1eedc,"""Current commercial implementations of binder jetting AM include:\n\n1.  Binding of metal powders followed by infiltration of a second metal to achieve full density.\n\n The three dimensional objects are built using metal powders in order to achieve the high density and this 3D printing technology was founded by MIT with the reference of binder jetting AM. \n\n2.Binding of metal powders followed by sintering to achieve near full density.\n\n While manufacturing the complex metal parts, a high powered laser is used to form a thin layer of metal powder, which results in the formation of a high density binding.\n\n3.Manufacturing of rapidly dissolvable pharmaceutical tablets/pills involves several methods, such as transition of crystalline and phase, compression using direct methods, and therefore cannot be considered for binder jetting AM.\n\n4.Direct printing of meter-scale metal components, such as ship propellors\n\nThe SLM machines use lasers to their full capacity in order to fuse layers of metal onto their respective parts.\n\n5.Fabrication of sand molds for casting of meter-scale metal components involves pouring sand into molds to create the desired shape, but the density of the material is not achieved using binder jetting AM.\n\nIn conclusion, binder jetting AM is a 3D printing technology that uses a combination of metal powders and a binder to create solid objects with high density. The technology has various applications in industries such as aerospace, automotive, and healthcare.\n\nFinal answer: Binder jetting AM is a 3D printing technology that uses a combination of metal powders and a binder to create solid objects with high density. Current commercial implementations include binding of metal powders followed by infiltration or sintering.\n""","""Error"" in the statement ""While manufacturing the complex metal parts, a high powered laser is used to form a thin layer",clp0pkunl00eb1aro88ry1csc,65414db2dc8e65e4dfe4963c,Computer Science Single Turn
,654e6ec7dd9cb38a62f0c547,"""**Improved answer:** \n\nPromoting code from a sandbox environment to a production environment is essential for several reasons:\n\n1.  Thorough testing and validation are necessary to ensure the code functions as intended and fix any issues before deployment to the live system.\n2.  The production environment requires stability and reliability to maintain end-user satisfaction. Promoting code changes from the sandbox to production helps address any issues before they affect end-users.\n3.  Security and compliance are critical in the production environment. Promoting code involves following security protocols to protect sensitive data and maintain system integrity.\n\n\n\nFinal answer: In summary, promoting code from a sandbox environment to a production environment is necessary to ensure thorough testing, stability, security, consistency, performance, and version control, ultimately providing a seamless and consistent experience for end-users while minimizing the risk of disruptions or issues.\n""",No Error,clp0pkwby00eh1aro9ywy7caf,65414db2dc8e65e4dfe4963c,Computer Science Single Turn
,654e6ed3d22b64aee3a1b588,"""**The Role of the Operating System in Memory Protection and I/O Access in Multi-Programmed Systems**\n\nIn a multi-programmed system, where multiple programs are running concurrently, the operating system (OS) plays a critical role in ensuring the safe and efficient execution of these programs. Two key mechanisms employed by the OS to achieve this are memory protection and privileged I/O operations.\n\n\n\n**a) Memory Protection**\n\nMemory protection is a fundamental security mechanism that prevents unauthorized access to memory spaces. In a multi-programmed system, each program has its own memory space, which contains its code, data, and stack. Without memory protection, a program could inadvertently or maliciously access the memory space of another program or the OS, leading to data corruption, crashes, or security breaches.\n\n\n\nThe OS implements memory protection using hardware and software techniques. Hardware memory management units (MMUs) translate virtual memory addresses used by programs into physical memory addresses, ensuring that each program only accesses its own designated memory space. Software techniques, such as page tables and segmentation, further reinforce memory protection by dividing memory into smaller, more manageable units and tracking access permissions for each unit.\n\n\n\n**b) Privileged I/O Operations**\n\nInput/output (I/O) operations involve interacting with hardware devices, such as keyboards, displays, storage drives, and network interfaces. Direct access to I/O device control registers, which control the behavior of these devices, is considered privileged and can only be performed by the OS running in kernel mode. This restriction is essential for several reasons:\n\n\n\n**Preventing Unintentional Interference:** Uncontrolled access to I/O devices could lead to conflicts between programs vying for the same device or disrupt the OS's management of I/O resources.\n\n\n\n**Protecting Hardware from Malicious Code:** Malicious code could exploit direct access to I/O devices to damage hardware, corrupt data, or gain unauthorized control over the system.\n\n\n\n**Ensuring Consistent and Reliable I/O Operations:** The OS's I/O management ensures consistent and reliable access to I/O devices, preventing programs from interfering with each other's I/O operations.\n\n\n\n**c) User Code Access to I/O Operations**\n\nWhile user processes cannot directly access I/O device control registers, they can still perform I/O operations through system calls provided by the OS. When a user process needs to perform an I/O operation, it makes a system call, which traps the program into kernel mode. The OS then handles the I/O operation on behalf of the user process, ensuring that the operation is executed correctly and securely. This mechanism allows user processes to interact with I/O devices without compromising system stability or security.\n\n\n\n**Final answer:** The operating system plays a crucial role in protecting the system's resources and ensuring that user processes cannot interfere with each other or the operating system. By providing memory protection, making I/O operations privileged, and controlling user access to I/O operations, the operating system helps ensure the system's reliability, security, and performance.\n""",No Error,clp0pkx1w01ww1aqi0snp3qyd,65414db2dc8e65e4dfe4963c,Computer Science Single Turn
,6542ea4e5934898e6c51e3cb,"""A process can be terminated in an operating system due to various reasons. Two of the most common reasons are:\n\n1.  **Normal Completion**:\n    A process can complete its execution in a normal manner by executing an OS service call. When a process finishes its execution, it sends a termination signal to the operating system, indicating that it has completed its task. The operating system then releases the resources allocated to the process, and the process is terminated.\n2.  **Protection Error**:\n    A process can be terminated when it tries to use a resource to which access is not granted or uses it in an inappropriate manner. This is done by the operating system to protect the system resources and prevent any malicious activity. For example, if a process tries to access a file that it does not have permission to access, the operating system will terminate the process to prevent any unauthorized access.\n\nFinal answer: A process can be terminated due to normal completion or a protection error.\n""",No Error,clp0pkyiu00gh1apm31f9d4ia,65414db2dc8e65e4dfe4963c,Computer Science Single Turn
,654e6ead1e83cc4c1e3724a3,"""Databases offer a plethora of advantages and applications, making them indispensable tools for managing and utilizing information. Their key benefits include:\n\n*   **Efficient Data Storage:** Databases provide a structured and organized approach to storing data, ensuring easy retrieval and manipulation. They eliminate redundancy and minimize data duplication, saving storage space and improving efficiency.\n*   **Data Integrity and Security:** Databases safeguard data integrity by enforcing data consistency and preventing unauthorized access or modifications. Access controls and encryption mechanisms protect sensitive information, ensuring its confidentiality and reliability.\n*   **Improved Data Accessibility:** Databases facilitate seamless data access, enabling users to retrieve and share data quickly and easily. User-friendly interfaces and search functionalities make data readily accessible to authorized individuals.\n\n\n\n**Operating a Database Program: Step-by-Step**\n\nTo effectively operate a database program, follow these basic steps:\n\n1.  **Database Creation:** Begin by creating a new database and defining the tables and fields that will store your data. Each table represents a collection of related data, while fields define the specific attributes of each data element.\n2.  **Data Entry:** Populate the database tables with relevant information. Most database programs offer user-friendly interfaces for data entry, making it straightforward to add, modify, or delete records.\n3.  **Data Retrieval:** Utilize the database's search and query features to locate specific data. Basic searches allow filtering based on simple criteria, while advanced searches support complex queries using Boolean operators, wildcards, and fuzzy matching.\n4.  **Data Modification:** Modify existing data within the database using the editing features provided. Make sure to maintain data integrity and consistency during any modifications.\n5.  **Data Analysis and Reporting:** Generate reports using the database program's reporting features to analyze and visualize data. These reports can summarize trends, identify patterns, and provide valuable insights for decision-making.\n\n\n\nSearch features are crucial for efficiently locating data within a database. They allow users to filter and narrow down their search results based on specific criteria.\n\n*   **Basic Search:** Basic search features enable users to find data based on simple criteria, such as keywords, dates, or numerical values. These searches are straightforward and suitable for quick data retrieval.\n*   **Advanced Search:** Advanced search features provide more sophisticated search options, allowing users to combine multiple criteria, utilize Boolean operators, and apply wildcards or fuzzy matching. These advanced searches are particularly useful for complex data queries.\n\n\n\n**Purposes of Search Features**\n\nSearch features serve the essential purpose of enabling users to quickly and easily locate the data they need within a database. They facilitate efficient data access, saving time and effort, and are essential for effective data management and analysis.\n\n\n\n**Final answer:** Databases are powerful tools that offer a multitude of advantages for managing, storing, and analyzing data. Understanding the principles of database operation, including data entry, retrieval, modification, and analysis, is crucial for effectively utilizing these systems. Search features play a pivotal role in efficiently locating data within databases, making them indispensable for data retrieval and analysis tasks.\n""",No Error,clp0pkz7i00ly1atyhp4yffj5,65414db2dc8e65e4dfe4963c,Computer Science Single Turn
,654e6ecc9c8565dbe49cce9d,"""V.42 is a more efficient compression algorithm than MNP5 for several reasons. Firstly, V.42 utilizes a dictionary-based compression algorithm, which stores a list of common patterns in data and replaces them with shorter codes, resulting in more effective compression. In contrast, MNP5 uses a less sophisticated algorithm that does not employ a dictionary.\n\nSecondly, V.42's encoding scheme is more efficient than MNP5's, requiring fewer bits to represent each compressed data unit. This leads to faster transmission speeds and reduced data loss.\n\nThe table below summarizes the key differences between V.42 and MNP5:\n\n| Feature               | V.42             | MNP5             |\n| --------------------- | ---------------- | ---------------- |\n| Compression algorithm | Dictionary-based | Dictionary-based |\n| Encoding scheme       | Efficient        | Less efficient   |\n| Age                   | Newer            | Older            |\n| Compression ratio     | Up to 20% better | Up to 20% worse  |\n| Transmission speed    | Up to 20% faster | Up to 20% slower |\n\nFinal answer: In conclusion, V.42's superior compression ratio, more efficient encoding scheme, and newer age make it a better choice for data compression than MNP5. V.42 can achieve compression ratios up to 20% better than MNP5, resulting in transmission speeds up to 20% faster.\n""","Error: ""| Compression algorithm | Dictionary-based | Dictionary-based |"" The text states that MNP5 does not employ a dictionary",clp0pkzxl00em1aroc5jbeejf,65414db2dc8e65e4dfe4963c,Computer Science Single Turn
,654e6ecdaf69b8b6ba3e9440,"""**Improved answer:**\n\nThe question of whether the US government should ban the deployment of vehicles with SAE Level 3 automation is a complex one, with both advantages and disadvantages to consider. On the one hand, the technology has the potential to increase road safety and traffic efficiency. Autonomous cars are able to respond to changes in their surroundings more rapidly and precisely than human drivers, which may contribute to a decrease in both the frequency and severity of car accidents. Additionally, the technology could potentially reduce traffic congestion by allowing vehicles to travel closer together.\n\nAnother concern is the potential for more traffic on the roadways. While autonomous cars would be able to travel closer together, this could result in more traffic, which might result in more collisions and longer commutes. Furthermore, the technology could result in a worsening of the driving experience.\n\n\n\nFinal answer: The US government should consider a ban on the deployment of vehicles with SAE Level 3 automation in order to thoroughly evaluate the potential benefits and risks of the technology and address the ethical concerns associated with it.\n""",No Error,clp0pl1p302ld1as6hhc1hbfr,65414db2dc8e65e4dfe4963c,Computer Science Single Turn
,654e6ecadd9cb38a62f0c7d9,"""```java\npublic class Main {\n   public static void main(String[] args) {\n      int[] arr = {9, 2, 4, 8, 3};\n      int even_sum = 0;\n      for(int i = 0; i < arr.length; i++) {\n         if(i % 2 == 0) {\n            even_sum += arr[i];\n        }\n      }\n      System.out.println(even_sum);\n   }\n}\n```\n\n1.  First , we will **declare** the array $arr = {9, 2, 4, 8, 3}$.\n2.  We will **initialize** a integer variable $\\text{even_sum} = 0$.\n3.  We will **run a for loop** from $i=0$ to $\\text{arr.length}$.\n4.  We will **check whether the element is at even position** or not, with condition $i%2 == 0$.\n\n    *   if $i\\%2 == 0$, means the element is at even position, then we will add the element to even\\_sum.\n5.  After the completion of for loop, We will **print** the **sum of all elements** at **even position**.\n\nFinal answer: This code uses a for loop to iterate over the elements of the array, and checks if the index of the element is even using the modulo operator ($i%2 == 0$). If the element is even, it adds it to the even\\_sum variable. This approach is more efficient and adaptable to changes in the array size, compared to directly adding the elements at even positions.\n""",No Error,clp0pl29p04ap1aqgg88idyaz,65414db2dc8e65e4dfe4963c,Computer Science Single Turn
,654e6ea91e83cc4c1e372196,"""## Main Objectives of a Risk Management Plan:\n\nA risk management plan is a crucial component of any project or business endeavour, as it aids organizations in identifying, assessing, and mitigating potential risks that may arise during their activities. The main objectives of a risk management plan are:\n\n\n\n### Identify risks:\n\nThe first step is to identify potential hazards by examining various project or organizational components, such as goals, resources, and external factors.\n\n### Assess risks: \n\nAnalyze each risk's likelihood and potential impact after identification. This is necessary to prioritize risks and focus on the most critical ones. Risk assessment can also help organizations understand the possible effects of risks and plan accordingly.\n\n### Develop mitigation strategies: \n\nThe risk management plan should include methods to lessen or mitigate each risk's possible negative impacts after the risks have been assessed. \n\n### Assign responsibility: \n\nThe plan should designate particular people or teams with the duty of carrying out risk mitigation techniques. This helps ensure efficient communication and coordination and guarantees clear accountability for controlling each risk.\n\n### Monitor and review: \n\nRegularly update the risk management plan, track progress, and adapt to changes in the project or organization for effective risk control.\n\n### Communicate risks:\n\nShare identified risks and corresponding mitigation strategies with relevant stakeholders, fostering transparency and collaboration.\n\n### Continual Improvement:\n\nContinuously enhance the risk management process by learning from past experiences and incorporating stakeholder feedback. This iterative approach ensures the plan remains applicable and effective.\n\n\n\n### Final Answer:\n\nBy tackling these goals, organizations prepare themselves to reduce possible adverse effects, improve decision-making procedures, and raise the probability of project or business venture success. These goals' succinct articulation makes it possible to comprehend the complex role that a risk management plan plays in the success of an organization.\n""",No Error,clp0pl2wc00es1aro469ofxjs,65414db2dc8e65e4dfe4963c,Computer Science Single Turn
,654e6eab1e83cc4c1e3722d3,"""*   In the perceptron algorithm here we initialize the vector w arbitrarily. \n\n<!---->\n\n*   **Step 0:** Initialize w = \\[0,6,6]T\n\nIn this step, we set the initial weight vector w to \\[0,6,6]T. This vector will be used in the subsequent steps to compute the sign of the dot product of w and each xi.\n\n*   **Step 1:** Compute y1 = sign(wT x1) = sign(0x1+6x2+6x3) = sign(12) = +1 (correct classification)\n*   **Step 2:** Compute y2 = sign(wT x2) = sign(0x1+6x2+6x3) = sign(20) = +1 (correct classification)\n*   **Step 3:** Compute y3 = sign(wT x3) = sign(0x1+6x2+6x3) = sign(12) = +1 (incorrect classification)\n*   **Step 4:** Update w = \\[0,6,6]T + η(-1)\\[1,0,2]T = \\[0,6,4]T\n*   **Step 5:** Compute y3 = sign(wT x3) = sign(0x1+6x2+4x3) = sign(8) = -1 (correct classification)\n\nFinal answer: Final weight vector: w==\\[0, 6, 4]T.\n""",No Error,clp0pl3i600m31atych9xbvw8,65414db2dc8e65e4dfe4963c,Computer Science Single Turn
,6542ea482309929d8f043a12,"""**Improved answer:**\n\nThe # symbol is not permissible to be included in a URL sent to an HTTP server due to its status as a special character with a specific role in URL syntax. In URL conventions, the # symbol signifies the commencement of a fragment identifier, utilized to identify a specific section or element within an HTML document. When a URL with a # symbol is transmitted to an HTTP server, the server interprets the # symbol as the initiation of a fragment identifier and does not forward the segment of the URL that follows the # symbol to the server.\n\nFor instance, if a URL like \""<http://www.example.com/page.html#anchor>\"" is directed to an HTTP server, the server recognizes the # symbol as the commencement of a fragment identifier. Consequently, the server only processes the request for the \""page.html\"" file, omitting the anchor portion of the URL.\n\nHence, it is impermissible to dispatch a URL containing a # symbol to an HTTP server as it does not conform to the valid URL syntax, leading to misinterpretation by the server.\n\nFinal answer: No, the # part is not sent to the HTTP server because it is a special character used to indicate the beginning of a fragment identifier in URL syntax. \n""",No Error,clp0pl45x01xh1asahxsj12dt,65414db2dc8e65e4dfe4963c,Computer Science Single Turn
,654e6ed37eb0bdfb945e3e4d,"""Find the element that matches the key 40, we can follow these steps:\n\nStep 1:\nThe middle element of the list is 52. Compare 52 with 40. Since 40 is less than 52, we can ignore the upper half of the list (57, 68, 71, 80, 82, 87).\n\nStep 2:\nThe new middle element is 30. Compare 30 with 40. Since 40 is greater than 30, we can ignore the lower half of the list (9, 28, 30).\n\nStep 3:\nThe new middle element is 36. Compare 36 with 40. Since 40 is greater than 36, we can ignore the lower half of the list (36).\n\nStep 4:\nThe new middle element is 40. Compare 40 with 40. Since 40 matches 40, we have found the element that matches the key.\n\nFinal answer: The elements in the order checked are 52, 30, 36, 40.\n""",No Error,clp0pl4sg01xm1asabv845z68,65414db2dc8e65e4dfe4963c,Computer Science Single Turn
,6542ea4eb8f13df437fb3a5e,"""**Improved answer:**\n\nDemorgan's Laws:\n\nDe Morgan's laws are a set of rules that simplify Boolean algebra expressions. They are named after Augustus De Morgan, a British mathematician and logician. The laws are as follows:\n\n1.  The complement of the union of two sets is equal to the intersection of the complements of the sets.\n\n(A ∪ B)’ = A’ ∩ B’\n\n1.  The complement of the product of two sets is equal to the union of the complements of the sets.\n\n(A ⋅ B)’ = A’ ∪ B’\n\nProperties of Gray Code and Excess 3 Code:\n\nGray code is a binary numeral system where two successive numbers differ by only one bit. Excess-3 code is a variant of the Gray code where the difference between two successive numbers is three. The properties of Gray code and Excess-3 code are as follows:\n\n1.  Gray code:\n\na. Each number can be obtained by changing only one bit from the previous number.\n\nb. The difference between two successive numbers is only one bit.\n\nc. The number of 1s in a Gray code sequence is always even.\n\nd. Gray code can be used to encode binary data in a way that minimizes errors.\n\n1.  Excess-3 code:\n\na. Each number can be obtained by changing only one bit from the previous number, and the difference between two successive numbers is three.\n\nb. The number of 1s in an Excess-3 code sequence is always odd.\n\nc. Excess-3 code can be used to encode binary data in a way that minimizes errors.\n\n\n\nFinal Answer: \n""","Error: ""Excess-3 code is a variant of the Gray code where the difference between two successive numbers is three.""",clp0pl5dl01xr1asafhrb64uc,65414db2dc8e65e4dfe4963c,Computer Science Single Turn
,6542ea440af75fdb56525768,"""**Improved answer:**\n\nThe main goal of the Minimum Cost Spanning Tree (MST) algorithms is to find the minimum cost path that connects all the nodes in a graph or network while ensuring that the total cost of the path is minimized. The algorithm starts by selecting an arbitrary node as the root node and then iteratively adds edges to the tree in a way that minimizes the total cost of the tree. The algorithm continues until all nodes are connected to the tree or there are no more edges that can be added to the tree without exceeding the minimum cost constraint.\n\nThe MST algorithm is used in various real-world applications, such as:\n\n1.  **Network design in the telecommunications sector**: MST is used to design the most cost-effective network that connects all the nodes in a telecommunications network.\n2.  **Logistics and transportation**: MST is used to find the shortest path for delivery trucks to take, minimizing the cost of fuel and time.\n3.  **Online orders and delivery**: MST is used to optimize the delivery routes for online orders, ensuring that the delivery driver takes the shortest path to reach the customer's location.\n4.  **Urban planning**: MST is used to design the most efficient public transportation system, minimizing the cost of infrastructure and maximizing the convenience for passengers.\n\nThe MST algorithm uses a greedy approach, selecting the edge that minimizes the total cost of the tree at each step. The algorithm terminates when there are no more edges that can be added to the tree without exceeding the minimum cost constraint.\n\nFinal answer: The main goal of the MST is to find the minimum-cost path that connects all the nodes in a graph or network, such that the total cost of the path is minimized. Some real-world applications of MST include:\n\n*   Network design in the telecommunications sector \n*   Logistics and transportation\n*   Online orders and delivery\n*   Urban planning.\n\n""",No Error,clp0pl6yv00m81atyf8t341cq,65414db2dc8e65e4dfe4963c,Computer Science Single Turn
