project,task_id,response,assessment,reqid,project_id,project_name
,6542ea465934898e6c51e202,"""### **Improved answer:** \n\n*Compare the advantages and disadvantages of a multipage form that uses tab controls versus a multipage form that uses page breaks.*\n\n*A multipage form can be divided into several sections using either tab controls or page breaks. Tab controls are graphic control elements that allow users to select from a number of mutually exclusive options, while page breaks are used to divide a document into logical sections. Both methods have their advantages and disadvantages.*\n\n\n\n### Advantages of tab controls include:\n\n1.  **Easy navigation between pages:** Users can quickly switch between pages by clicking on a tab.\n2.  **Space-saving:** Tab controls can reduce the amount of white space on a form, especially when there is a lot of content.\n3.  **Visually appealing:** Tab controls can organize a form and make it more aesthetically pleasing.\n\n### Disadvantages of tab controls include:\n\n1.  **Confusion:** Users may find tab controls confusing, especially if there are many tabs.\n2.  **Printing challenges:** Printing a form with tab controls can be more difficult, as each tab may need to be printed separately.\n3.  **Editing challenges**: Editing a form with tab controls can be more challenging, as users may need to open each tab separately to make changes.\n\n### Advantages of page breaks include:\n\n1.  **Simple navigation:** Users can easily navigate between pages by clicking on a page break.\n2.  **Logical segmentation:** Page breaks can help to logically segment a form, making it easier to understand and complete.\n3.  **Easy editing:** Page breaks can facilitate form editing, as users only need to open the page that contains the material they wish to change.\n\n### Disadvantages of page breaks include:\n\n1.  **Confusion:** Users may find page breaks perplexing, especially if there is a lot of text.\n2.  **Printing challenges:** Printing a form with page breaks can be more challenging, as each page may need to be printed separately.\n3.  **Completion challenges:** Completing a form with page breaks can be more challenging, as users may need to navigate back and forth between pages to find the information they need.\n\n### Final Answer:\n\nIn conclusion, both tab controls and page breaks have their advantages and disadvantages. The choice between the two ultimately depends on the specific needs of the form and the user's preferences.\n""",No Error,clp0pljeu04bd1aqg3bi9b25i,65414db2dc8e65e4dfe4963c,Computer Science Single Turn
,654e6ed3d668ac8b1f3e91f0,"""**Improved answer:**\n\nThe valid IP addresses for hosts belonging to the 10.1.160.0/20 subnet are those that fall within the range of IP addresses defined by the subnet mask, which is 255.255.240.0. This subnet mask defines the first 20 bits of the IP address that are used to identify the subnet, while the remaining 12 bits are used to assign IP addresses to individual hosts within the subnet.\n\nTo determine the valid IP addresses for the 10.1.160.0/20 subnet, we can apply the following steps:\n\n1.  Convert the subnet mask to binary format: 255.255.240.0 = 11111111.00000000.00000000. 00000000\n2.  Identify the first 20 bits that define the subnet: 11111111.00000000.00000000\n3.  Calculate the number of possible subnets: 2^12 = 4096\n4.  Calculate the first IP address of the subnet: 10.1.160.0 = 10.1.160.00000000\n5.  Calculate the last IP address of the subnet: 10.1.160.255 = 10.1.160.25500000\n6.  Identify the valid IP addresses for the subnet: 10.1.160.0, 10.1.160.1, 10.1.160.2, ..., 10.1.160.254\n\nThe valid IP addresses for hosts in the 10.1.160.0/20 subnet range from 10.1.160.1 to 10.1.175.254, considering the subnet mask 255.255.240.0. The first 20 bits of the IP address are used to identify the subnet, and the remaining 12 bits are available for assigning individual host addresses within that subnet. Therefore, the valid IP addresses within this subnet are:\n\n*   10.1.160.1\n*   10.1.160.2\n*   ...\n*   10.1.175.253\n*   10.1.175.254\n\nFinal answer: The valid IP addresses for hosts in the 10.1.160.0/20 subnet range from 10.1.160.0 to 10.1.175.255, considering the subnet mask 255.255.240.0.\n""","Error: ""Calculate the last IP address of the subnet: 10.1.160.255 = 10.1",clp0plkae01yb1asa273yc1g0,65414db2dc8e65e4dfe4963c,Computer Science Single Turn
,654e6ec487dc0e93f62dd5c1,"""Information technology (IT) is the use of computers, software, networks, and the Internet to store, process, transmit, and deliver information. IT has a significant impact on organizations, society, and individuals in various ways. Some of them are:\n\n*   **Organizations:**\n\n**a.** **Improved Efficiency:** Automation and streamlining of processes have led to increased productivity and reduced costs. For instance, Amazon's use of robotics and AI in its warehouses has increased efficiency by 50%.\n\n**b.** **Enhanced Communication and Collaboration:** IT has enabled seamless communication and collaboration within and outside organizations. Slack, a popular communication platform, has increased productivity by 32% for its users.\n\n**c. Decision Making and Strategic Planning:** Data analytics tools have enabled organizations to make informed decisions and develop effective strategies. For example, Netflix's data-driven approach has helped it grow its user base to over 220 million subscribers.\n\n**d. Competitive Advantage:** Organizations that effectively leverage IT can gain a competitive edge. Uber's use of data analytics and GPS technology has enabled it to dominate the ride-sharing market.\n\n*   **Society:**\n\n**a. Improved Access to Information:** The internet and IT have democratized access to knowledge and information, bridging the information gap between developed and developing countries. Wikipedia, a free online encyclopedia, has made knowledge accessible to over 50 million users in 300 languages.\n\n**b. Global Connectivity:** IT has connected people worldwide, fostering global collaboration, cultural exchange, and activism. Social media platforms like Facebook and Twitter have enabled people to connect and communicate with others across the globe.\n\n**c. Economic Growth:** IT has become a driving force for economic growth, creating new industries and transforming existing ones. E-commerce platforms like Alibaba and eBay have revolutionized the retail industry, while online marketplaces like Airbnb and Uber have transformed the hospitality and transportation sectors.\n\n**d. Digital Divide:** Despite the numerous benefits of IT, a digital divide remains, with disparities in access to technology, education, and job opportunities.\n\n*   **Individual:** \n\n**a. Increased convenience:** IT has made life easier for individuals by enabling online shopping, banking, entertainment, and communication. \n\n**b. Changed work patterns:** IT has also changed how people work by allowing remote and flexible work options. \n\n**c. Personal development and learning:** IT has improved personal development and learning by providing online courses, tutorials, and resources.\n\n\n\n**Final answer:** Information technology has revolutionized organizations by enhancing efficiency, communication, decision-making, and competitive advantage. It has transformed society by improving access to information, connecting people globally, driving economic growth, but also creating a digital divide. At the individual level, IT has increased convenience, changed work patterns, and facilitated personal development, but also raised concerns about privacy and security. \n""",No Error,clp0plls200gz1apm4bjg8o7a,65414db2dc8e65e4dfe4963c,Computer Science Single Turn
,654e6eab1e83cc4c1e3722d6,"""**Yes**, a computer system can detect *process starvation* by tracking **resource allocation and utilization, monitoring performance metrics, implementing process priority levels, detecting deadlocks** and using **watchdog timers**.\n\nTo **address process starvation**, the system can **adjust resource allocation**, **kill or suspend low-priority processes**, or **optimize scheduling algorithms** to ensure fair distribution of resources.\n\nTo avoid process starvation:\n\n1.  ***Proper resource allocation***:  allocate resources based on the needs of each process like CPU, bandwidth, I/O devices and memory.\n2.  ***Manage process priorities***: Assign priority levels to processes using scheduling algorithms and ensure higher tasks are not starved by lower tasks.\n3.  ***Fair scheduling***: Implement fair scheduling and use algorithms that ensure each process receives a reasonable share of system resources.\n4.  ***Employ preemption and time slicing***: Allocate fixed time slices to prevent long-running processes from monopolizing resources.\n5.  ***Prevent and resolve deadlocks***: Prevent deadlocks which can lead to starvation.\n6.  ***Monitor performance***: Continuously monitor system performance metrics and optimize system configurations.\n7.  ***Implement load balancing***: Distribute the workload across multiple systems or processors using load balancing techniques.\n\nFinal answer: By implementing strategies like ***Proper resource allocation**, **Process priorities management**, **fair scheduling, Preemption, Deadlock prevention** and **load balancing*** process starvation can be effectively addressed and avoided, ensuring the efficient operation of the computer system.\n""",No Error,clp0plmfh00mm1atygf86gb3h,65414db2dc8e65e4dfe4963c,Computer Science Single Turn
,6542ea4a7c65017cb429d161,"""**Improved answer:** A retail organization looking to streamline its supply chain and inventory management procedures is a business case that would profit from a business intelligence solution. The company needs to optimize its inventory management to prevent stockouts and overstocking because it operates many outlets in various regions. The organization aims to enhance its supply chain procedures in order to decrease lead times and boost client satisfaction.\n\nThe business intelligence solution would provide the company with real-time data and insights on inventory levels, sales trends, and supply chain performance. The business would be able to recognize patterns and trends in consumer behavior which would enable it to optimize its inventory levels and lower the number of stockouts. In addition, the system would give the business access to real-time data on the efficiency of the supply chain, enabling it to spot bottlenecks and shorten lead times.\n\nThe solution involves collecting data from point-of-sale, inventory, and supply chain systems, analyzing it using algorithms like regression and clustering, and providing real-time insights through dashboards and reports, thereby enhancing the company's inventory management and supply chain processes.\n\nThe advantages of using the business intelligence solution with ad hoc queries are:\n\n1.  Real-time data and insights: The solution would provide the company with real-time data and insights on inventory levels, sales trends, and supply chain performance, enabling it to make informed decisions quickly.\n2.  Improved decision-making: The solution would enable the company to identify patterns and trends in customer behavior, which would help it to optimize its inventory levels and reduce stockouts.\n\nFinal answer: The retail company will utilize a business intelligence solution to optimize inventory management and supply chain processes, utilizing real-time data and analytics and incorporating data visualization tools like dashboards and reports.\n""",No Error,clp0pln08004w1apg5tkk55i2,65414db2dc8e65e4dfe4963c,Computer Science Single Turn
,654e6ed3312a35d482d41620,"""Allocating too much capacity to a location can result in poor utilization, leading to higher costs. This occurs when the capacity allocated exceeds the demand, resulting in underutilization of resources. As a consequence, the costs associated with maintaining and operating the facility increase, without a corresponding increase in efficiency or productivity.\n\nTo illustrate this concept, let's consider an example. Suppose a company has a production facility with a capacity of 1000 units per day, but the daily demand is only 700 units. In this scenario, the facility is operating at 70% utilization (700 units / 1000 units). This means that 30% of the capacity is unused (300 units), resulting in wasted resources and increased costs.\n\nOn the other hand, allocating too little capacity can result in poor responsiveness, leading to missed opportunities and potential loss of customers. In such cases, the company may need to rely on more expensive alternatives, such as outsourcing or expediting shipments, to meet customer demand. This can negatively impact profitability and undermine the competitiveness of the business.\n\n**Final answer:** Capacity allocation is a critical decision that can significantly impact the performance and profitability of a business. It is essential to strike a balance between capacity and demand to achieve optimal utilization and minimize costs. Effective capacity allocation can lead to improved efficiency, reduced expenses, and increased customer satisfaction.\n""",No Error,clp0plnlp01xj1aqicgs8hs6w,65414db2dc8e65e4dfe4963c,Computer Science Single Turn
,654e6ed09c8565dbe49cd1ed,"""*   The Amazon Echo Dot is a widely used IoT-based device that offers a range of features and functionalities, making it an ideal choice for a \""hall of fame and shame analysis\"" from an HCI perspective.\n*   Firstly, the Echo Dot relies heavily on voice commands, which can be a challenge for users who have difficulty speaking or whose accent is not recognized by the device.\n*   Secondly, the Echo Dot's sensitivity can sometimes be a problem, as it may respond to unintended commands or noises. This can lead to a frustrating user experience, especially when the device mistakenly interprets background noise as a command. \n*   Thirdly, the Echo Dot's reliance on Amazon's cloud services raises privacy concerns around the data that is collected and stored by the company. While Amazon has implemented some measures to protect user data, such as encrypting voice recordings, there is still a lack of transparency around how the data is used and shared. \n*   Finally, Amazon could provide users with more information about how their data is being used and shared, including details about any third-party companies or services that have access to their data. \n\nFinal answer: In conclusion, the Amazon Echo Dot is a popular IoT-based device that offers a range\n""",No Error,clp0plo5x01xo1aqi0d42hxg0,65414db2dc8e65e4dfe4963c,Computer Science Single Turn
,654e6ecd57bba3e1dd76a6a1,"""*   Firewalls are an essential component of any comprehensive security strategy, as they help protect against unauthorized access to a network or system by monitoring and filtering traffic based on predetermined rules and policies.\n*   Firewalls have their limitations, as they can only monitor and filter traffic based on the predetermined rules and policies that are programmed into them. Skilled attackers can bypass firewalls using techniques like social engineering or exploiting vulnerabilities in the system, rendering the firewall ineffective.\n*   To provide comprehensive protection against a wide range of threats, it is important to use a combination of security measures in conjunction with firewalls. Intrusion detection and prevention systems, antivirus software, data encryption, and regular security audits can help prevent unauthorized access and protect against internal threats. Regular employee training and awareness programs can also help prevent insider threats and accidental data breaches.\n*   Final answer: Firewalls are an important component of any security strategy, but they should be used in conjunction with other security measures to provide comprehensive protection against a wide range of threats, both internal and external.\n\n""",No Error,clp0plos504bj1aqgarou8xp7,65414db2dc8e65e4dfe4963c,Computer Science Single Turn
,6542ea4db4aa219ac41c47fa,"""1\\. Recognizing attacks:  By keeping an eye on network activity and reviewing system logs, attacks can be found. For instance, a brute-force attack may be detected if a system receives a lot of login attempts from a single IP address in a short amount of time. Another illustration would be keeping an eye out for odd file access or system configuration changes.  1. Recognizing an intrusion  Intrusion detection systems (IDS) keep an eye on network activity in order to spot malicious or unauthorized activity. They have the ability to issue warnings and take action to stop additional harm. Network-based IDS (NIDS) and host-based IDS (HIDS) are the two categories into which IDS can be divided. While HIDS monitors system logs and processes, NIDS keeps an eye on network traffic.  1. Recognizing denial of service:  System log analysis and network traffic monitoring can both be used to identify service denial. For instance, a denial-of-service (DoS) attack may be indicated if a system is being inundated with requests for a specific service. Another illustration would be keeping an eye out for odd resource usage or system crashes.  1. Determining message latency  System logs and network traffic analysis can be used to identify message delays.\n\n “Final answer:...\\[Network activity and system logs can be used to detect attacks, intrusions, denial of service, and message latency. Attacks can be detected by monitoring login attempts, file access, and configuration changes. Intrusion detection systems (IDS) can identify malicious or unauthorized activity, issue warnings, and take action. System log analysis and network traffic monitoring can also be used to identify service denial, resource usage, and system crashes. Lastly, system logs and network traffic analysis can help determine message latency.].”\n""",No Error,clp0plpku00ms1aty21r36qj4,65414db2dc8e65e4dfe4963c,Computer Science Single Turn
,6542ea4d34236eaa79a4eade,"""**Improved answer:**\n\nWhen a computer's RAM becomes full, it can significantly slow down the system's performance. RAM (Random Access Memory) is a volatile memory technology that stores data and program instructions that are currently being used by the CPU (Central Processing Unit). When the RAM is full, the computer has to rely on the hard disk as a temporary memory store, also known as swap memory.\n\nThe hard disk is a non-volatile memory technology that stores data and programs permanently. However, it is much slower than RAM, and using it as a temporary memory store can significantly slow down the system's performance. This is because hard disks have mechanical parts that need to move to access data, whereas RAM is an electronic memory that can access data much faster.\n\nWhen the RAM is full, the CPU has to repeatedly access the hard disk to retrieve data and instructions, which can lead to a significant decrease in system performance. This can result in slower response times, longer load times, and overall sluggish behavior.\n\nTo avoid this situation, it is essential to manage RAM usage effectively. Here are some steps that can help free up RAM space:\n\n1.  Close any applications that are not required at the moment. \n2.  Uninstall any applications that are no longer needed or used. This will not only free up RAM space but also declutter the system.\n3.  Clear the cache memory of applications that are frequently used.\n4.  Adding more RAM to the computer can increase the amount of available memory, improving overall system performance.\n\nBy following these steps, you can ensure that your computer's RAM is free from clutter and can perform tasks efficiently. It is important to note that while using the hard disk as a temporary memory store is an option, it is not an ideal solution and should be avoided whenever possible.\n\nFinal answer: To avoid slow performance due to a full RAM, it is essential to manage RAM usage effectively by closing unnecessary applications, uninstalling unused applications, and clearing application cache.\n""",No Error,clp0plq5e00fb1aroatlzehsx,65414db2dc8e65e4dfe4963c,Computer Science Single Turn
,6542ea497c823bbfa0b64d5a,"""**Improved answer:**\n\nIn the realm of access control, a subject is an entity—such as a user, process, or application—that seeks access to a specific resource or object. Access control, a fundamental concept in security, governs resource access by managing the interaction between subjects and objects.\n\nAccess control involves two key components: subjects and objects. The subject is the entity attempting to access a resource, while the object is the resource itself, whether it be a file, record, database, or other protected entity.\n\nWhen a subject requests access to an object, access control principles determine whether the attempt is authorized. The subject's access is contingent upon possessing the requisite permissions or access rights, which the object's owner typically assigns. These permissions dictate what actions the subject can perform on the object.\n\nIn essence, the subject-object dynamic underscores the importance of regulating resource access. Access control mechanisms ensure that only entities with appropriate permissions can access specific resources. Whether a user, process, or application, the subject must align with the access rights defined by the object's owner to interact with the object securely.\n\nFinal answer: A subject is an entity capable of accessing an object and must have the appropriate permissions or access rights to do so.\n""",No Error,clp0plquh00h81apm952t8fca,65414db2dc8e65e4dfe4963c,Computer Science Single Turn
,6542ea44a40a9b4c109da73c,"""Managing scalability and maintaining database performance are two major challenges in database management, especially as data volume increases. The limitations of managing scalability and maintaining database performance include:\n\n**Resource constraints**: As data volume increases, database systems may require more resources such as memory, disk space, and processing power, which can become expensive and limit scalability. For example, if a database system requires 10 servers to handle the current workload, it may need 20 servers to handle twice the workload, which can be cost-prohibitive.\n\n**Performance degradation**: As the amount of data stored in a database grows, query performance can degrade, leading to slow response times and decreased system efficiency. This can be due to increased disk I/O, CPU utilization, and memory usage, which can result in slower query execution times.\n\n**Consistency issues**: Maintaining consistency in a distributed database system can be challenging, especially as the number of nodes and the volume of data increase. This can be due to the difficulty in ensuring that all nodes have the same data values, which can lead to inconsistencies and errors.\n\n**Complexity**: Scaling a database system can increase its complexity, making it more difficult to manage and maintain. This can be due to the increased number of servers, networks, and storage devices, which can make it harder to ensure data consistency and integrity.\n\n**Concurrency**: As the number of users and transactions increases, concurrency control becomes a critical issue to ensure that data remains consistent and accurate. This can be due to the increased likelihood of conflicts between concurrent transactions, which can result in inconsistent data values.\n\nFinal answer: Managing scalability and maintaining database performance are crucial in database management, but they come with several limitations. These limitations can be addressed through various techniques such as database partitioning, caching, indexing, and efficient query optimization. However, finding the right balance between scalability and performance can be challenging, and requires careful planning and ongoing monitoring and tuning of the database system.\n""",No Error,clp0plrhz00fg1arobs92bzwm,65414db2dc8e65e4dfe4963c,Computer Science Single Turn
