project,task_id,response,assessment,reqid,project_id,project_name
,654e6ea4705fe06734d1e1c7,"""*   **Improved answer:** \n\n> *   Enterprise systems are comprehensive software solutions that enable organizations to integrate and coordinate their business processes efficiently. These systems are designed to manage and streamline the entire business operations of an organization, providing a centralized platform for all business processes. By automating and optimizing various business functions, enterprise systems help organizations to improve productivity, reduce costs, and enhance decision-making capabilities.\n>\n> <!---->\n>\n> *   The benefits of enterprise systems are numerous, including improved transparency, flexibility, and compliance. For instance, enterprise systems can help organizations to manage employee data, track project progress, and maintain accurate financial records. Additionally, these systems can enforce compliance with regulatory requirements, ensuring that employees adhere to certain rules and policies.\n>\n> <!---->\n>\n> *   One of the primary reasons for using Enterprise Resource Planning (ERP) systems is to increase efficiency and reduce costs. By automating routine tasks and providing real-time data, ERP systems enable organizations to make informed decisions and respond quickly to changing business conditions. Moreover, ERP systems can help organizations to streamline their supply chain management, inventory management, and customer relationship management processes, leading to further cost savings and improved productivity.\n>\n> <!---->\n>\n> *   Another significant advantage of ERP systems is their ability to promote collaboration and integration across different business functions. By providing a single centralized platform for all business processes, ERP systems enable organizations to break down silos and facilitate communication between different departments. This integration helps organizations to identify areas of inefficiency and make improvements, leading to enhanced overall performance.\n>\n> In conclusion, enterprise systems, and specifically ERP systems, are essential tools for businesses seeking to improve their efficiency, productivity, and decision-making capabilities. By automating routine tasks, promoting collaboration, and providing real-time data, these systems help organizations to achieve their goals and stay competitive in today's fast-paced business environment. \n\n### Final answer: \n\n**Enterprise systems, and specifically ERP systems, are vital for businesses to succeed and grow.**\n""",No Error,clp0pk5bb02kh1as6dla8htex,65414db2dc8e65e4dfe4963c,Computer Science Single Turn
,654e6ece7eb0bdfb945e3d2d,"""**Improved answer:**\n\nIn the event of a data breach, it is crucial to take immediate and effective measures to minimize the damage and protect the customers and reputation of the company. The following steps should be taken:\n\n1.  Notify affected customers:\n    The company should promptly inform affected customers of the breach via email or letter, providing a clear explanation of the incident, the types of information that were stolen, and steps they can take to protect themselves. \n2.  Investigate and secure the website:\n    The company should collaborate with a reputable security firm to conduct a thorough investigation of the breach, identify the vulnerability that was exploited, and determine the scope of the attack. \n3.  Report the breach to authorities:\n    The company is required by law to report the breach to the relevant authorities, such as the Federal Trade Commission (FTC) in the United States, within 30 days of discovery. \n4.  Mitigate reputational damage:\n    The company should take proactive steps to minimize the negative impact on its reputation. This may involve issuing a public statement about the breach, providing information on how customers can protect themselves, and working to improve the company's security practices. \n\n\n\nFinal answer: By taking these comprehensive steps, the company can effectively respond to a data breach, protect its customers, and minimize the damage to its reputation.\n\n""","Error: The company is required by law to report the breach to the relevant authorities, such as the Federal Trade Commission (FT",clp0pk5v704aa1aqgf21r3kou,65414db2dc8e65e4dfe4963c,Computer Science Single Turn
,654e6ea6979d33d575b81d25,"""**The binary number 0.101 corresponds to the decimal number 0.625.** To convert a binary number to decimal, we need to understand the place value of each digit in the binary number and how it corresponds to a decimal value. In binary, each digit can have a value of either 0 or 1, and the value of each digit depends on its position or place value. The rightmost digit represents the ones place, the next digit to the left represents the twos place, the next digit represents the fours place, and so on.\n\nTo convert a binary number to decimal, we first identify the place value of each digit and then calculate the decimal value of each digit based on its place value. We do this by multiplying the binary digit by its corresponding power of 2 (starting with 2^0 for the rightmost digit). For example, the binary number 0.101 can be converted to decimal as follows:\n(1 x 1/2) or (1 x 2^-1) + (0 x 1/4) or (0 x 2^-2) + (1 x 1/8) or (1 x 2^-3) = 1/2 + 0 + 1/8 = 5/8 = 0.625\n\n**Final answer:** To convert a binary to decimal multiply each digit in binary number by the value it represents (i.e. 2 raised to the power of its position starting from 0 for the rightmost number before decimal, positive to the left, and negative to the right. For example, in 10.01, the position of 0 before the decimal has a position 0, 1 after it has a position 1, 0 after the decimal will have a position -1, and 1 after it will have a position -2). This way the decimal value of 0.101 binary number is 0.625.\n""",No Error,clp0pk6zb01w41aqib5vcfaub,65414db2dc8e65e4dfe4963c,Computer Science Single Turn
,6542ea45c8c48397e4be5be2,"""**Improved answer:**\n\nTo calculate 0.005mW + (-45dBm), we need to follow the formula,\nP(dBm) = 10 ⋅ log10( P(m.W) / 1m.W)\n\nFirstly, we need to convert 0.005mW to dBm.\nP(dB.m) = 10 ⋅ log10( 0.005m.W / 1m.W) = -23.010299957d.Bm\n\nNext, we need to add -45dBm to -23.010299957d.Bm\nP(dB.m) = -23.010299957 + (-45) = -68.010299957d.Bm\n\nTherefore, 0.005mW + (-45dBm) = -68.010299957dBm\n\nFinal answer: The sum of 0.005mW and (-45dBm) is -68.010299957dBm.\n""","Error: ""Therefore, 0.005mW + (-45dBm) = -68.010299957dB",clp0pk7og00de1aro5g459uh4,65414db2dc8e65e4dfe4963c,Computer Science Single Turn
,654e6ecc9c8565dbe49cce98,"""**LinkedIn**, a professional networking platform, **faced a massive data breach in June 2021**, which **exposed personal information of approximately 700 million users**. As a result of the breach, the **company faced several legal issues** and **consequences**.\n\n***Here are five legal issues faced by LinkedIn and the laws violated:***\n\n1.  **Data Protection and Privacy Laws**: The breach exposed sensitive information, such as email addresses, phone numbers, and employment information, of millions of users. LinkedIn may have violated several data protection and privacy laws, including the General Data Protection Regulation (GDPR) and the California Consumer Privacy Act (CCPA).\n2.  **Breach Notification Laws**: Many states have laws that require companies to notify users if their personal information is compromised in a data breach that Linkedln have violated.\n3.  **Negligence Laws**: LinkedIn may have breached its duty of care to its users by failing to implement adequate security measures to protect user data. \n4.  **Consumer Protection Laws**: LinkedIn's failure to protect user data may have violated various consumer protection laws, such as unfair and deceptive trade practices acts, and state and federal laws that prohibit unfair business practices.\n5.  **Securities Laws**: LinkedIn is a publicly traded company, and the breach may have affected the company's financial performance, leading to a violation of securities law.\n\n***Consequences Faced due to Scandal:*** \n\n*   Reputational Damage, Financial losses, Regulatory scrunity, Legal actions, User losses, Operational Disruption, Remediation cost, Loss of trust and many more.\n\nFinal answer: Summarizing, due to the data breach happened in June 2021 Linkedln faced data protection and privacy laws, breach notification law, negligence law, consumer protection, securities laws. Linkedln also faced **Reputational Damage**, **Financial losses**, **Regulatory scrunity**, **Legal actions**, **User losses**, **Operational Disruption**, **Remediation cost**, **Loss of trust** and many more **consequences** due to scandal.\n""","Error: ""**LinkedIn**, a professional networking platform, **faced a massive data breach in June 2021**, which **",clp0pk8vu00dj1arogdsc9rds,65414db2dc8e65e4dfe4963c,Computer Science Single Turn
,654e6ed79776be9af16f7da2,"""There are two approaches to MPLS TTL handling: Uniform and Pipe mode. SR OS only implements the Pipe mode.\n\nIn the Pipe mode, the TTL value is incremented only at the egress node of a**n** MPLS domain, unlike the Uniform mode where the TTL value is decremented at each hop along the path. \n\nThis approach allows for more efficient use of TTL values and reduces the likelihood of premature TTL expiration. The egress node refers to a network device, such as a router, located at the edge of a network and serves as the exit point for traffic leaving the network.\n\nIn the Uniform mode, the TTL value of an MPLS packet is decremented at each hop along the path, similar to IP routing. This approach allows for better end-to-end TTL value control in large MPLS networks with many hops. However, it can increase the risk of premature TTL expiration.\n\nFinal answer: There are two approaches to MPLS TTL handling. SR OS only implements the Pipe mode, which increments the TTL value only at the egress node of an MPLS domain, providing more efficient use of TTL values and reducing the likelihood of premature TTL expiration. These are two approaches to MPLS TTL handling.\n""","Error: ""In the Pipe mode, the TTL value is incremented only at the egress node of a**n** MPL",clp0pka3k01wa1aqidw2f3yy1,65414db2dc8e65e4dfe4963c,Computer Science Single Turn
,654e6ed77eb0bdfb945e3f73,"""The Kalman filtering and smoothing updates for the variant of the LDS model with an additional latent transition depending on an observed sequence of inputs y1:T are as follows:\n\n*   zt+1 = Azt + Byt + wt\n*   xt = Czt + Ddt + wt\n*   Vt = AVt-1AT + Q\n*   Kt = VtC'/(CVtC' + R)\n*   zt = Azt+1 + Kt(xt - Czt+1 - Ddt)\n*   Vt = (I - KtC)Vt+1\n\nTo estimate the parameters, we can use the EM algorithm. The E-step involves computing the posterior distribution of the latent variables given the current parameters and the observed data:\n\np(zt|xt,yt,θt)\n\nThe M-step involves updating the parameters to maximize the expected log-likelihood of the data given the current posterior distribution of the latent variables:\n\nθt+1 = argmaxθt ∑zt log p(xt,yt,zt|θt)p(zt|xt,yt,θt)\n\nThe EM-based parameter estimation procedure changes as follows:\n\nE-step:\n\n*   Compute the posterior distribution of the latent variables given the current parameters and the observed data: p(zt|xt,yt,θt)\n\nM-step:\n\n*   Update the parameters to maximize the expected log-likelihood of the data given the current posterior distribution of the latent variables: θt+1 = argmaxθt ∑zt log p(xt,yt,zt|θt)p(zt|xt,yt,θt)\n\nFinal answer: The Kalman filtering and smoothing updates change as follows:\n\n*   zt+1 = Azt + Byt + wt\n*   xt = Czt + Ddt + wt\n*   Vt = AVt-1AT + Q\n*   Kt = VtC'/(CVtC' + R)\n*   zt = Azt+1 + Kt(xt - Czt+1 - Ddt)\n\n""",No Error,clp0pkbh304je1as31tc3547w,65414db2dc8e65e4dfe4963c,Computer Science Single Turn
,6542ea4df371387c56dcd265,"""\n\nNetwork bandwidth is the amount of data that can be transmitted over a network connection within a specific time frame. It is measured in bits per second (bps) or bytes per second (Bps), and it determines the maximum rate at which data can be transmitted over a network. The availability of bandwidth on a network can be influenced by various factors, such as the type of network connection, the distance between devices, the number of users connected to the network, and the presence of network congestion or interference.\n\nTo better understand network bandwidth, let's consider an example. Imagine you are streaming a movie from a video-on-demand service. The quality of the video depends on the amount of bandwidth available on your network connection. If you have a high-speed internet connection with a large amount of bandwidth, the movie will stream smoothly and with good quality. However, if your internet connection has limited bandwidth, the movie may buffer or stream slowly, resulting in a poor viewing experience.\n\nIn conclusion, network bandwidths are a critical aspect of computer networking, and they determine the maximum rate at which data can be transmitted over a network. Understanding the factors that affect bandwidth can help network administrators optimize their networks for better performance\n\nFinal answer: Network bandwidth is the amount of data that can be transmitted over a network connection within a specific time frame, measured in bits per second (bps) or bytes per second (Bps). It is measured in bits per second or bytes per second.\n""",No Error,clp0pkc6h01wh1asaclyd9y7f,65414db2dc8e65e4dfe4963c,Computer Science Single Turn
,6542ea48b4aa219ac41c4764,"""A complex number is a number that is made up of a real number and an imaginary number. It can be represented in the form z = a + ib, where a and b are real numbers. This notation is known as the rectangular form or Cartesian form. The real part of the complex number is denoted by a, while the imaginary part is denoted by ib. Complex numbers arise from the need to express negative numbers' roots, which real numbers cannot do. The imaginary part has a square that is negative.\n\nTo understand this notation, let's consider a complex number, z = 3 + 4i. We can represent it in the rectangular form as z = 3 + 4i = 3 + 4(i). Here, 3 is the real part, and 4 is the imaginary part.\n\nThe real part is the coefficient of the real axis, which is 3 in this case. The imaginary part is the coefficient of the imaginary axis, which is 4 in this case.\n\nIt's important to note that the imaginary part is represented by the symbol i, which is defined as the square root of -1. This is a mathematical concept that allows us to represent complex numbers in a more convenient and intuitive way.\n\nIn summary, a complex number can be represented in the form z = a + ib, where a and b are real numbers.This notation is useful for performing operations on complex numbers, such as addition, subtraction, multiplication, and division.\n\nFinal Answer: A complex number can be represented in the form z = a + ib, where a and b are real numbers. The real part is denoted by a, and the imaginary part is denoted by ib.\n""",No Error,clp0pkcrq00fw1apm681z1cl3,65414db2dc8e65e4dfe4963c,Computer Science Single Turn
,6542ea452d8c9297e107ab53,"""To determine the bit rate of the required PCM signal, we first need to calculate the Nyquist rate, which is given by:\n\nNyquist rate = 2 \\* 5kHz = 10kHz\n\nHowever, the signal must be sampled at 1.5 times the Nyquist rate. So, the sampling rate is = 1.5 \\* 10 kHz = 15 kHz\n\nNow, the bit rate (Rb​) of a PCM signal can be determined using the formula:\n\nRb = fs×Bits per sample×Number of channels\n\nHere, we need to consider the signal-to-noise ratio (SNR) in quantization, and the relationship between SNRquant and the number of bits per sample (N) is given by:\n\nSNRquant=6.02×N+1.76 dB\n\nGiven that SNRquant should be at least 60 dB, we can set up the equation:\n\n60 dB=6.02×N+1.76 dB60dB=6.02×N+1.76dB\n\nSolving for N:\n\n58.24 dB=6.02×N\n\n58.24dB=6.02×N\n\nN≈9.69\n\nSince we cannot have a fraction of a bit, we round up to N=10.\n\nNow, we can calculate the bit rate:\n\nRb=15 kHz×10 bits per sample×1 channel\n\nRb​=150kbps\n\nFinal answer: The bit rate of the required PCM signal is approximately 150 kbps.\n""",No Error,clp0pkddp01wm1asafrx8h0fn,65414db2dc8e65e4dfe4963c,Computer Science Single Turn
,6542ea447c65017cb429cf9d,"""Python's standard development/runtime environment is called IDLE. IDLE is an Integrated Development Environment (IDE) that comes bundled with Python. It provides a Python shell and a text editor, along with several other useful tools, for developing and testing Python code. IDLE is suitable for both beginners and experienced Python developers due to its lightweight and user-friendly nature.\n\nIDLE has several features that make it an excellent choice for Python development, including syntax highlighting, code completion, and debugging tools. It also has a built-in help system that provides documentation for Python functions and modules, making it easy to learn and use the Python language.\n\nIn summary, IDLE is a widely used and highly regarded tool in the Python community for developing, testing, and debugging Python code. Therefore, the statement \""The name of the Python std. development/runtime environment is called IDLE\"" is true.\n\nFinal answer: The name of the Python std. development/runtime environment is called IDLE is True.\n""",No Error,clp0pke0m002j1aqheapn04r1,65414db2dc8e65e4dfe4963c,Computer Science Single Turn
,6542ea48aabaf0a4f2fafd28,"""Causal research is a type of marketing research that aims to establish cause-and-effect relationships between variables. It is particularly useful in situations where marketers want to understand the impact of a specific variable on a particular outcome. For example, if a company wants to know the effect of a price change on sales, causal research would be the most suitable type of research to inform the development of marketing strategies.\n\nTo conduct causal research, **the researcher must identify all the variables in the environment that could influence the relationship between the two variables of interest**. This can be challenging because the researcher may be unaware of hidden variables that could affect the relationship. However, by using techniques such as **randomization and control groups, causal research can help marketers identify the causal effect** of a particular variable on an outcome.\n\nThe advantages of causal research include the ability to identify the cause of a particular trend or pattern, which can help marketers optimize their business outcomes.\n\nExamples of causal research include:\n\n*   Analyzing the impact of a change in product price on consumer behaviour\n*   Investigating the effect of a marketing campaign on brand awareness\n*   Understanding the impact of a new product launch on sales\n\nFinal answer: Causal research is the most suitable type of marketing research to inform the development of marketing strategies when marketers want to understand the causal effect of a particular variable on an outcome. Be cautious in identifying the new variables it can be challenging to find the significant factors or variables.\n""",No Error,clp0pken100g11apm2ysr0aq6,65414db2dc8e65e4dfe4963c,Computer Science Single Turn
,6542ea486eb89a27afa2dd44,"""Let's start by identifying the given information:\n\n*   30% of the students in the class are in the band.\n*   The total number of students in the class is not provided.\n\nWe want to find out how many students are not in the band.\n\nFirst, we'll need the total number of students in the class. Once that information is provided, we can proceed with the calculation.\n\nAssuming there are 3 students in the class (for illustrative purposes): 30% of 3 students = 0.3 \\* 3 = 0.9 students\n\nNow, we can calculate the number of students who are not in the band: 3 - 0.9 = 2.1\n\nSince we can't have a fraction of a student, we round down to the nearest whole number: 2.1 = 2 students\n\nTherefore, if there are 3 students in the class, there are 2 students who are not in the band.\n\nFinal answer: 2 students.\n""","Error: ""Assuming there are 3 students in the class (for illustrative purposes): 30% of 3",clp0pkf9t01wr1asaagtcbwn7,65414db2dc8e65e4dfe4963c,Computer Science Single Turn
,654e6ec357bba3e1dd76a184,"""In a substitution cipher, each letter in the plaintext is replaced by a different letter in the ciphertext. To decrypt it, one could try all 26! possible decryption keys. However, this is not feasible, as the number of keys is too large. Even with powerful computers, it would take too long to try all the keys.\n\nAlso, the substitution cipher has more than one solution, meaning that many decryption keys can make sense of the ciphertext. This makes it hard to find the right decryption key, making the attempt to try all keys pointless.\n\nMoreover, the Index of Coincidence (IOC), a statistical measure that shows how often letters repeat in a text, cannot tell the decryption key or the plaintext apart. The IOC can reveal some features of a language, but it is not enough to decrypt reliably.\n\nBesides substitution ciphers, there are other encryption methods, such as transposition ciphers, polyalphabetic ciphers, or modern encryption algorithms, that require different ways to decrypt. Therefore, it is important to know the encryption method used and use more advanced techniques, such as frequency analysis, pattern recognition, and encryption algorithm knowledge, to decrypt successfully.\n\n**Final answer:** Having the capability to try all possible decryption keys and compute the IOC for each resulting text may seem like a powerful tool, but it is ultimately impractical, ineffective, and insufficient to decrypt a substitution cipher or any other encryption method. Successful cryptanalysis involves a combination of techniques, including frequency analysis, pattern recognition, and knowledge of encryption algorithms, tailored to the specific encryption method used.\n""",No Error,clp0pkgg900lm1atyfvwg2yin,65414db2dc8e65e4dfe4963c,Computer Science Single Turn
,6542ea4886df2d82b53ec98c,"""**Using a single switch instead of multiple miniature switches has advantages regarding network design. Switching terms can be replaced with buttons, which offer a centralized management point for the entire network, making monitoring and controlling network traffic easier.** This can lead to better network performance and reduced downtime. Additionally, buttons can handle more devices and traffic, reducing the need for multiple controllers and the complexity associated with managing them.\n\n*   A single button can also provide better network security by enabling a more straightforward implementation of security policies and access control. Troubleshooting and maintenance are easier as all network traffic passes through a single point, saving time and resources when identifying and resolving network issues.\n*   In contrast, using multiple miniature buttons can increase complexity, as each controller must be configured and managed individually. This can result in higher maintenance costs and a more significant potential for errors or security breaches. Additionally, miniature buttons may not be able to handle the same volume of traffic as a single switch, leading to reduced network performance and slower data transfer rates.\n*   In conclusion, using a single button instead of multiple miniature switches offers several advantages, including centralized management, improved network performance, better security, and easier troubleshooting and maintenance.\n\nFinal Answer: **Using a single button instead of multiple miniature switches can improve network performance, reduce downtime, and simplify network management, security, troubleshooting, and maintenance. In contrast, using numerous miniature buttons can increase complexity, maintenance costs, errors, and security risks while reducing network performance and data transfer rates.**\n""","Error: ""Switching terms can be replaced with buttons, which offer a centralized management point for the entire network, making monitoring",clp0pkh2802kq1as62c3e9567,65414db2dc8e65e4dfe4963c,Computer Science Single Turn
,654e6eab705fe06734d1e5cb,"""Evidence: 5\nProblem Areas:  \n\n**Improved version of the student's answer:**\n\nAs digital forensics investigators, we may encounter various Apple devices while conducting a search, including Mac computers, iPhones, iPads, Apple Watches, and Apple TVs. To investigate these devices, we will need specialized digital forensics tools, such as a write-blocker, a digital forensic toolkit, a device-specific cable, and a Faraday bag. \n\nWhen investigating Apple devices, we should focus on the following potential digital evidence:\n\n1.  Communications: We can examine text messages, emails, social media messages, and other forms of communication that may be stored on the device.\n2.  Internet activity: We can examine browsing history, search history, and other internet-related activities that may provide evidence of criminal activity.\n3.  GPS data: iPhones and iPads track the location of the device, and we can use this data to establish the suspect's movements.\n\n\n\n\n\nFinal answer: In conclusion, investigating digital evidence on Apple devices can reveal vital information about criminal activities. It's important to use appropriate digital forensic tools and techniques to ensure the evidence collected is valid and admissible in court.\n""",No Error,clp0pkiaz04jl1as3crtecf1h,65414db2dc8e65e4dfe4963c,Computer Science Single Turn
