project,task_id,response,assessment,reqid,project_id,project_name
,654e718080b1f6125c61a049,"""Indigo Air, also known as InterGlobe Aviation Ltd, has a high exit barrier due to its significant investment in the industry. The company has taken loans and has investors, making it difficult to leave the industry. Most of its primary assets, such as planes and infrastructure, can only be purchased by another airline company, further limiting its exit options. Additionally, the aviation industry is heavily regulated, and Indigo Air would need to comply with various government regulations before it can exit the market.\n\nOn the other hand, Bongswag, an e-commerce company that specializes in tee-shirts, has a low exit barrier. The e-commerce sector is highly competitive, with new companies entering and exiting the market regularly. The stakes are low, and the market is shrinking rapidly, making it easy for companies to exit the industry. Bongswag's assets, such as inventory and technology, are not unique to the company and can be easily sold or transferred to another business.\n\nFinal answer: Indigo Air has a high exit barrier due to its investment, regulations, and limited buyers, while Bongswag has a low exit barrier due to the competitive nature of the e-commerce sector and ease of asset transfer.\n""","""Error"" in the statement ""The stakes are low, and the market is shrinking rapidly, making it easy for companies to",clp0q81zg00xw1aty0lm56wp1,65414aaab70a41e7c12761fa,Economics Single Turn 
,654e713d8611e43d8da00935,"""Negotiations between business professionals have both advantages and disadvantages that set them apart from personal negotiations. One significant benefit of business negotiations is the utilization of market pricing to evaluate a deal. This approach allows business professionals to make informed decisions based on the current market conditions, ultimately leading to better outcomes. In contrast to personal negotiations, business relationships are long-term commitments built on networks of relationships that require continuous communication and trust-building.\n\nBusiness negotiations provide many benefits, but they also have some drawbacks. For example, when market pricing becomes the main focus, it can limit flexibility during negotiations. Moreover, building trust quickly is essential in business negotiations, unlike personal negotiations where trust is established gradually over time.\n\nBusiness negotiations offer a significant advantage in that they allow for the expansion of the pie, unlike personal negotiations where the parties often settle too quickly. This implies that businesspeople can collaborate and come up with innovative solutions that benefit both parties, ultimately leading to better outcomes.\n\nIn conclusion, negotiations in business have both advantages and disadvantages, but they differ from personal negotiations in several key ways. Businesspeople who understand these differences can navigate negotiations more effectively and achieve successful outcomes.\n\nFinal answer: Negotiations between businesspeople come with both benefits and drawbacks. On the positive side, market pricing can be used, and there is potential for increased outcomes. Additionally, quick trust-building is essential. However, these types of negotiations differ from personal ones in a number of ways. They are typically less flexible, and building trust quickly is of utmost importance.\n""",No Error,clp0q83ad004x1arwbgk5exv0,65414aaab70a41e7c12761fa,Economics Single Turn 
,654e717f40bcf76e7294ac69,"""A comparison of public sector growth based on expenditure growth and employment growth can differ in several ways. Firstly, expenditure growth reflects changes in the amount of money the government spends, while employment growth reflects changes in the number of people the government hires. For instance, if the government increases its spending on a particular program without hiring more employees, the expenditure growth would increase, but the employment growth would remain the same.\n\nSecondly, expenditure growth can be affected by factors such as changes in the prices of goods and services purchased by the government, while employment growth is generally more directly tied to changes in the demand for services provided by the government. For example, if the government purchases more computers at a higher price, the expenditure growth would increase, but the employment growth would not be affected.\n\nThirdly, expenditure growth can be affected by changes in the efficiency or effectiveness of government in providing services, while employment growth is generally more directly tied to changes in demand for the services that government provides. For instance, if the government implements a more efficient way of delivering a particular service, the expenditure growth might decrease, but the employment growth would remain the same.\n\nLastly, expenditure growth can be affected by changes in the overall size of the economy, while employment growth is generally more directly tied to changes in demand for government-provided services. For example, if the economy grows, the government might have more resources to spend, leading to an increase in expenditure growth, but the employment growth would not necessarily change.\n\n**Final answer:** The comparison of growth in the public sector depends on various factors. These can lead to differences between the growth in government expenditures and employment. Therefore, a comprehensive analysis of the public sector should consider both expenditure and employment data to provide a more complete picture of government operations. \n""",No Error,clp0q83x3028l1asaas9l8xws,65414aaab70a41e7c12761fa,Economics Single Turn 
,654e7187820b683cda128ba4,"""The correct answer is c) The doctor-patient relationship.\n\nExplanation:\n\nThe principal-agent theory refers to a situation where one party (the principal) delegates decision-making authority to another party (the agent) to act on their behalf. \n\n*   In the context of medical care, the doctor-patient relationship exemplifies the principal-agent theory.\n    In this relationship, the patient (the principal) seeks medical advice and treatment from the doctor (the agent), delegating the responsibility of making medical decisions and providing appropriate care. The patient relies on the expertise and professionalism of the doctor to act in their best interest.\n*   To further illustrate this point, consider a scenario where a patient is diagnosed with a serious illness. The patient may not have the knowledge or expertise to make informed decisions about their treatment options. In this case, the patient relies on the doctor to provide guidance and make decisions that will result in the best possible outcome. The patient delegates decision-making authority to the doctor, who acts as the agent responsible for providing appropriate care and treatment.\n*   The patient-payer relationship (option a) and the doctor-payer relationship (option b) do not necessarily capture the essence of the principal-agent theory. While financial transactions and payments are involved in healthcare, they do not fully represent the delegation of decision-making authority or the trust-based relationship between a doctor and a patient.\n\nIn summary, the principal-agent theory within medical care is best exemplified by the doctor-patient relationship (option c).\n\nFinal answer:\nThe doctor-patient relationship exemplifies the principal-agent theory in medical care (option c), as it involves the delegation of decision-making authority from the patient to the doctor, with the doctor acting as the agent responsible for providing appropriate care and making treatment decisions. The patient places their trust in the doctor's expertise and professionalism, and the doctor acts in the patient's best interest, taking into account their medical history, current symptoms thereby ensuring appropriate care.\n""",No Error,clp0q84md04v01as3bl26dt6h,65414aaab70a41e7c12761fa,Economics Single Turn 
,654e71876bfeab5aaf4c8e5d,"""Suppose the government increased taxes and spending by \\$300,000. If the marginal propensity to consume is 0.80, what is the net effect on Gross Domestic Product?\n\nFirst, let's calculate the effect of tax increase on GDP:\n\n\n\nEffect of tax increase on GDP = Tax Multiplier x Change in Taxes\n\n\n\nEffect of tax increase on GDP = -4.0 x \\$300,000\n\n\n\nEffect of tax increase on GDP = -\\$1,200,000\n\n\n\nNext, let's calculate the effect of a spending increase on GDP:\n\n\n\nEffect of spending increase on GDP = Spending Multiplier x Change in Spending\n\n\n\nEffect of spending increase on GDP = 5.0 x \\$300,000\n\n\n\nEffect of spending increase on GDP = \\$1,500,000\n\n\n\nNow, let's calculate the net effect on GDP:\n\n\n\nNet effect on GDP = Effect of tax increase on GDP + Effect of spending increase on GDP\n\n\n\nNet effect on GDP = -1,200,000 + 1,500,000\n\n\n\nNet effect on GDP = \\$300,000\n\n\n\nTherefore, the net effect on Gross Domestic Product is an increase of \\$300,000.\n\n**Final answer:** The simultaneous increase in taxes and spending results in a net positive effect on Gross Domestic Product (GDP) by \\$300,000. This is because the positive impact of increased government spending outweighs the negative effect of higher taxes due to the respective tax and spending multipliers.\n""",No Error,clp0q859900521arw6xhlbcp1,65414aaab70a41e7c12761fa,Economics Single Turn 
,654e7176496086e596189646,"""In Pattie's situation at Hannigan, Fisher, and Schultz, applying the cultural intelligence (CQ) framework can provide valuable insights for navigating the complexities she faces as a working mother in a male-dominated industry.\n\n1.  **CQ Drive (Motivational):** Pattie's commitment to her job and promotion aspirations is evident, but she must also address potential biases and stereotypes that may hinder her advancement opportunities. She must maintain motivation while advocating for a more inclusive workplace culture.\n2.  **CQ Knowledge (Cognitive):** Pattie's firm culture is well-understood, but she could benefit from a deeper understanding of the male-dominated workplace and societal expectations surrounding working mothers, which can aid in effective strategizing and challenging biases.\n3.  **CQ Strategy (Metacognitive):** Pattie needs to adopt a strategic approach, including seeking mentorship, gathering evidence for promotion, considering alternative career paths, and reflecting on her assumptions and biases to avoid reinforcing the status quo.\n4.  **CQ Action (Behavioral):** Pattie must adopt a strategic approach, such as negotiating a flexible work arrangement, utilizing her professional network for support, and advocating for recognition within the firm, demonstrating her commitment to her career and family.\n\n**Using the Acquire, Build, Contemplate, and Do Approach:**\n\n*   **Acquire:** Pattie should educate herself on her legal rights and company policies regarding discrimination and family leave. Consulting with HR or legal advisors can offer clarity on her options.\n*   **Build:** Creating a supportive network, including colleagues, mentors, and professional groups, and documenting instances of unfair treatment can help strengthen her case.\n*   **Contemplate:** Reflecting on her situation and considering her long-term career and family goals is crucial. Professional advice from a career coach or a life coach can provide objective insights.\n*   **Do:** Pattie should utilize her network's advice, engage in discussions with superiors, seek new job opportunities, and balance her professional responsibilities with family life, possibly through delegation, boundaries, and self-care.\n\nFinal answer: Pattie can navigate her workplace challenges effectively using the cultural intelligence framework and concepts of acquire, build, contemplate, and do. She must understand workplace nuances, seek support, reflect on options, and take proactive steps for career advancement and personal fulfillment.\n""",No Error,clp0q85yt00y11atycw2b9k75,65414aaab70a41e7c12761fa,Economics Single Turn 
,6542d7b11f89c089e2e94eee,"""Sure! I'de be delighted to help!\n\nOpportunity cost refers to the value of the next best alternative forgone when a decision is made. In this scenario, we need to compare the opportunity costs of Krisjan, Katrin, Gunnar, and Freyja.\n\nEach individual, Krisjan, Katrin, Gunnar and Freyja, faces an opportunity cost associated with their financial decisions. Krisjan, who places his wage in a checking account with 10% interest rate, foregoes the potential returns from higher-interest investment. Katrin, contemplating a Treasury bill with a 7% interest rate, chooses not to invest, resulting in the opportunity cost of the potential returns from the Treasury bill. Gunnar's decision to avoid a 5% interest rate CD incurs an opportunity cost represented by the foregone potential returns from the CD. Lastly, Freyja, using her money for everyday expenses at a 3 percent interest rate, faces the opportunity cost of the potential returns from the alternative investments with higher interest rates.\\\nTo determine the highest opportunity cost, we compare the interest rates associated with each individual's financial decision:\n\n*   Krisjan's opportunity cost is the difference between the 10% interest rate of his checking account and potential returns from higher interest investments.\n*   Katrin's opportunity cost is the 7% interest rate of the Treasury bill.\n*   Gunnar's opportunity cost is the 5% interest rate of the CD.\n*   Freyja's opportunity cost is the 3% interest rate she could have earned by investing instead of using the money for everyday expenses.\n\nComparing these values, Krisjan incurs the highest opportunity cost by placing all his wages in a checking account with a 10 percent interest rate, potentially missing out on higher returns from alternative investment opportunities.\n\nFinal answer: The highest opportunity cost belongs to Krisjan, who is potentially missing out on higher returns from other investment opportunities by placing all his wages into a checking account with a 10 percent interest rate.\n\nIf you need more information, please feel free to ask!\n""","Error: ""Krisjan, who places his wage in a checking account with 10% interest rate, foregoes",clp0q86q900p71aro6h2jecgj,65414aaab70a41e7c12761fa,Economics Single Turn 
,654e717f38cd063189ff59ce,"""The budget line represents the different combinations of two goods that a consumer can purchase with their given income and the prices of the goods. The budget equation can be written as M = x.Px1 + y.Px2, where M is the total income, Px1 is the price of good x1, and Px2 is the price of good x2.\n\nGiven a budget of $200, the prices of good x1 and x2 are $4 and \\$3, respectively. Therefore, the equation for the budget line is 4x1 + 3x2 = 200.\n\nTo further explain the concept of a budget line, it is a graphical representation of the various combinations of two goods that a consumer can afford to purchase given their budget and the prices of the goods. The slope of the budget line represents the rate at which the consumer is willing to trade one good for the other. In this case, the slope of the budget line is -4/3, indicating that the consumer is willing to trade 4 units of good x1 for 3 units of good x2.\n\nThe budget line also shows the consumer's optimal choice, which is the point at which the budget line is tangent to the indifference curve. The indifference curve represents the different combinations of two goods that provide the consumer with the same level of satisfaction. The consumer's optimal choice is the point at which the budget line is tangent to the indifference curve, as it represents the combination of goods that maximizes the consumer's satisfaction given their budget and the prices of the goods.\n\n**Final answer:** The budget line represents the different combinations of two goods that a consumer can purchase with their given income and the prices of the goods. The equation for the budget line is 4x1 + 3x2 = 200, and it shows the consumer's optimal choice, which is the point at which the budget line is tangent to the indifference curve.\n""","Error: ""The slope of the budget line represents the rate at which the consumer is willing to trade one good for the other",clp0q883500rt1apm66780nkj,65414aaab70a41e7c12761fa,Economics Single Turn 
,6542d7a9f40c3b1410689c36,"""At the end of the 19th century, the United States exhibited imperialistic tendencies as a result of its desire to expand its influence and territory, as well as its belief in the superiority of Anglo-Saxon culture and race. This was fueled by three main factors: *the development of a powerful naval force, political and economic rivalry among industrialized nations, and the conviction in the cultural and racial supremacy of people of Anglo-Saxon descent*.\n\n*   American imperialism is not a straightforward concept, and its manifestations were not always clear-cut. For instance, while the US did expand its territory through the annexation of Hawaii and the Spanish-American War, it also asserted its influence through less direct means, such as economic and military intervention in countries like Cuba and the Philippines.\n*   Fast forwarding to the present day, global politics, economies, and societies are now more interconnected than ever before, and the concept of imperialism has evolved to include new forms of power and influence.\n*   Regarding the US's involvement in NATO and its actions in Afghanistan, it is clear that these are not instances of imperialism in the classical sense. The US and its allies have stated that their goal in Afghanistan is to protect the country from terrorist organizations and to promote stability and security in the region. Similarly, the US's support for Ukraine is aimed at protecting the country's sovereignty and territorial integrity in the face of Russian aggression.\n\nIn conclusion, while the US has exhibited imperialistic tendencies in the past, it is not accurate to say that it is an imperialist country today. The US's actions in NATO and its involvement in Afghanistan and Ukraine are better understood as attempts to promote stability and security in the region and protect its own interests, rather than a desire to colonize or assert cultural or racial superiority.\n\nFinal answer: The US is not an imperialist country today, but it has exhibited imperialistic tendencies in the past. It's current actions are aimed at protecting national interests and maintaining global stability, rather than asserting dominance over other nations.\n""",No Error,clp0q89lo00ry1apm5h5i158c,65414aaab70a41e7c12761fa,Economics Single Turn 
,6542d7c29ce46cfacbe818aa,"""Incentive pay is a compensation structure designed to motivate and influence employee behavior (A). It operates on the principle that the prospect of financial rewards drives employees to meet predetermined performance or financial goals. These incentives, including yearly, monthly, or one-time bonuses (B), should be administered carefully to avoid an exclusive focus on one objective at the expense of others (C), potentially neglecting essential job aspects.\n\nMoreover, employees may compare their input/output and rewards with other employees (D), which can foster a sense of competition and motivation. Non-monetary incentives, such as gifts or dinners, can also be used to motivate employees (A). These incentives can be offered in addition to or instead of monetary rewards.\n\nIn conclusion, incentive pay is a powerful tool for motivating employees and aligning their behavior with organizational goals. By understanding the different types of incentives and their potential impact, employers can create a fair and effective incentive pay system that benefits both the organization and its employees.\n\n**Final answer**: Incentive pay serves as a dynamic compensation framework crafted to inspire employees through the provision of financial or non-financial rewards upon the accomplishment of established objectives. This can manifest in diverse modalities, including bonuses, and may be complemented by non-monetary incentives.\n""",No Error,clp0q8agn00571arwd9oigwl6,65414aaab70a41e7c12761fa,Economics Single Turn 
,6542d7b3686e62744fc49acd,"""The economy of Venezuela is facing several significant weaknesses, which are impacting its growth and stability. \n\nSome of the key weaknesses include:\n\n1.  **Low GDP growth rate:** Venezuela's GDP growth rate has been consistently low, with estimates for 2019 and 2021 showing a contraction of -35% and -1%, respectively. In 2020, the GDP growth rate was -30%. This slow growth is a major concern for the economy.\n2.  **Current account deficit:** Venezuela is experiencing a current account deficit of minus 4.3, which is a significant challenge for the economy. A current account deficit occurs when a country's imports exceed its exports, leading to a decrease in its foreign exchange reserves and an increase in its foreign debt.\n3.  **High public debt**: Venezuela's public debt is very high, which is a major burden on the economy. The country's dependence on hydrocarbon loans from China, Russia, and Iran has created a significant debt burden, which is impacting the economy's ability to invest in other sectors.\n4.  **Non-transparent and discretionary management of oil resources:** The management of Venezuela's oil resources is non-transparent and discretionary, which has led to corruption and mismanagement. It resulted in lesser investment in the oil sector and hence decreased exports.\n5.  **Hyperinflation**: Venezuela is experiencing hyperinflation, which has eroded the purchasing power of its currency. This has led to a shortage of foreign currency and goods, making it difficult for people to access necessities.\\\n    In summary, Venezuela's economy grapples with several pressing challenges including low GDP growth, a significant current account deficit, a burdensome public debt, non-transparent oil resource management, and hyperinflation. Addressing these issues is vital for the nation's economic recovery and stability, requiring comprehensive reforms and prudent policies to secure a more prosperous future.\\\n    **Final answer**: The Venezuelan economy is grappling with significant weaknesses, including a low GDP growth rate, current account deficit, high public debt, and hyperinflation. The lack of transparency and discretionary management of oil resources has further exacerbated these issues. Addressing these points will require a comprehensive approach that includes social and political reforms and ensuring accountability and transparency.\n\n\n\n""",No Error,clp0q8b3f004h1as59pwr6287,65414aaab70a41e7c12761fa,Economics Single Turn 
,6542d7b33e915183a47f4790,"""The Gilded Age, a period of rapid industrialization and economic growth in the United States during the late 19th century, heralded profound transformations that forever reshaped the concept of freedom. On one hand, it witnessed the ascendance of laissez-faire policies, a fervent belief in the unfettered power of free markets. This ideology reinforced the idea that individuals had the liberty to pursue their economic interests without government interference. It was underpinned by the concept of the \""American Dream,\"" which held that hard work and determination could enable anyone to attain success and prosperity.\n\nConversely, the Gilded Age also witnessed the exacerbation of economic disparities. A small elite accumulated vast wealth and power, while a significant portion of the population struggled to make ends meet. This stark inequality raises fundamental questions about the existence of meaningful freedom in a society characterized by extreme economic imbalances. Can individuals be considered truly free when they are unable to access necessities such as food, shelter, and healthcare?\n\nGiven these disparities, it's clear that freedom extends beyond mere economic opportunities. True freedom includes economic security, education, healthcare access, and political engagement. Without these elements, individuals cannot fully exercise their autonomy and can become trapped in poverty and dependence. Thus, while the Gilded Age brought economic opportunities, it also highlighted the constraints of an overly economic-focused view of freedom. Real freedom necessitates a holistic approach considering social and political contexts.\n\n**Final answer:** The Gilded Age reminds us that freedom isn't just about economic prosperity. It requires a broader view that encompasses economic security, essential services access, and political participation. These elements are vital for individuals to exercise their agency and lead self-determined lives.\n""",No Error,clp0q8bt500s31apmdsla6n72,65414aaab70a41e7c12761fa,Economics Single Turn 
