project,task_id,response,assessment,reqid,project_id,project_name
,6542d7af686e62744fc4996d,"""It's a good question. Let me help.\n\nInnovation is the creation or improvement of products, processes, or services through creative thinking. It can impact various aspects of business, such as product development, process optimization, and marketing strategies.\n\nInnovation is crucial for leaders to stay ahead, identify new opportunities, and drive growth. It requires risk-taking, creativity, and a culture of innovation within teams.\n\nInnovation is essential for leaders because it allows them to:\n\n1.  Stay relevant in a rapidly changing marketplace\n2.  Address customer needs and preferences\n3.  Create new revenue streams\n4.  Differentiate their organization from competitors\n5.  Encourage a culture of creativity and experimentation\n\nBy embracing innovation, leaders can position their organizations for long-term success, adapt to changing market conditions, and achieve their strategic goals.\n\nFinal answer: We can say that Innovation is key to staying competitive in the marketplace. By fostering a culture of innovation, leaders can encourage creativity, take risks, and drive growth.\n""",No Error,clp0q913h004x1as52m6b52a8,65414aaab70a41e7c12761fa,Economics Single Turn 
,654e717966b9a60beb4e203c,"""The marketing mix is a fundamental concept in marketing that outlines the key elements of a marketing strategy. The four Ps of the marketing mix are product, place, promotion, and pricing. In the digital age, these elements have evolved and been affected by the rise of digital media.\n\n In the digital age, the product element of the marketing mix has expanded beyond the physical attributes of a product. With the rise of e-commerce, products can now be digital, such as software, e-books, or online courses. Digital media has also enabled businesses to create and promote products that cater to specific customer needs and preferences. \n\nIn terms of place, or distribution, products can now be sold and delivered digitally, eliminating the need for physical channels. This has enabled businesses to reach a global audience and has created new opportunities for small businesses and startups.\n\nPromotion has been greatly affected by digital media. Traditional marketing methods such as television, radio, and print ads have been replaced by digital marketing methods such as social media, content marketing, and search engine optimization. Digital media has enabled businesses to target specific customer segments and personalize their marketing messages. \n\nIn terms of pricing, businesses can now dynamically adjust their prices based on demand and competition. This has created new opportunities for businesses to offer discounts and promotions to customers in real-time. Digital media has opened up a whole new world of pricing strategies and opportunities for businesses to experiment with pricing depending on the preferences of their customer. \n\nFinal answer: Digital media has greatly impacted traditional approaches to marketing. As new technology penetrates the market, businesses will have to adapt their product, place, promotion, and pricing to create effective marketing campaigns.\n""",No Error,clp0q921k02vv1as6252t47gb,65414aaab70a41e7c12761fa,Economics Single Turn 
,654e7181a3633932f3bb6b1e,"""The correct response is option b) wants cannot be satisfied with the available resources.\n\nExplanation:\n\n*   The fundamental fact of life that gives rise to all economic problems is the scarcity of resources. This means that the wants, desires, and needs of individuals are unlimited, but the resources available to satisfy them are limited. \n*   This scarcity creates a need to allocate resources efficiently and make choices about which wants will be fulfilled and which will not.\n\nLet's consider an example to understand this concept in a better way:\n\n*   Imagine a small village with a limited amount of fertile land. The villagers want to grow crops to feed themselves and their families, but the land is not enough to satisfy all their wants. The villagers must then make a choice about how to allocate the limited land they have. They may decide to use the land to grow crops that will feed the most people, or they may decide to use it for other purposes, such as building homes or roads. This example illustrates the basic economic problem of scarcity and the need to make choices about how to allocate resources.\n\nThus, in a nutshell, scarcity is a core concept of economics and is essential to understanding the economic problems and the various challenges that all societies face.\n\nFinal answer:\nThe fundamental fact of life that gives rise to all economic problems is the scarcity of resources, which creates a need to allocate resources efficiently and make choices about which wants will be fulfilled and which will not. This concept is essential to understanding the economic problem and the challenges that all societies face. Hence, the correct option is b).\n""",No Error,clp0q92m902w01as676rnauf0,65414aaab70a41e7c12761fa,Economics Single Turn 
,654e71304b7e403ad2a72aa7,"""**Improved answer:** As a local sugar cane farmer, I am seeking to introduce my product into the global market. To achieve this, I have identified several critical ingredients or requirements that are necessary for success.\nFor starters, it is essential to have a high-quality product that offers value to potential customers. To ensure this, I have implemented strict quality control measures throughout the production process, from planting to harvesting and processing. This includes using superior seed varieties, advanced farming techniques, and state-of-the-art equipment.\nI will also need to implement a competitive pricing strategy to attract buyers in the global market. I have conducted extensive market research to determine the optimal price for my sugar cane product, taking into account factors such as production costs, market demand, and competition.\nThirdly, I will need a well-thought-out market-entry strategy for success in foreign markets. I have identified potential markets and developed a targeted marketing plan to reach these markets. This includes building relationships with local distributors and retailers, participating in trade shows and exhibitions, and creating a strong online presence.\nIt's also important to consider supply chain and logistics issues and how they might affect normal business activities. I have established partnerships with reliable transportation and storage providers to ensure that my product reaches customers on time and in good condition.\n\nFinal answer: My sugar cane product offers value to potential customers due to its high quality, competitive price, well-thought-out market-entry strategy, and efficient supply chain and logistics management. I am confident that these features will make my product competitive in global markets.\n""",No Error,clp0q93bc029n1asa5y1t6cmr,65414aaab70a41e7c12761fa,Economics Single Turn 
,654e7180a891f9f20e5adfb3,"""The short-run Phillips curve illustrates the negative relationship between inflation and unemployment. In the short run, a decrease in unemployment will lead to an increase in inflation, and vice versa. This is because when unemployment is low, businesses must compete for a smaller pool of workers, leading to higher wages and prices, and therefore, inflation. Conversely, when inflation is high, consumers' purchasing power decreases, leading to lower demand for goods and services, and therefore, higher unemployment.\n\nIn the long run, however, the Phillips curve becomes a vertical line at the natural rate of unemployment, indicating that there is no trade-off between inflation and unemployment. This is because the natural rate of unemployment is the rate at which wages and prices are flexible, and therefore, changes in inflation do not affect unemployment.\n\nThe aggregate demand curve, on the other hand, shows the relationship between the price level and the level of output. It is not directly related to the relationship between inflation and unemployment.\n\n**Final answer:**  Therefore, the correct answer is (B) short-run Phillips curve The short-run Phillips curve shows a negative relationship between inflation and unemployment, while the long-run Phillips curve becomes a vertical line at the natural rate of unemployment, indicating no trade-off between the two.\n""",No Error,clp0q941300f51apg450a22r7,65414aaab70a41e7c12761fa,Economics Single Turn 
,654e717e22ecdf9995f3e6a6,"""To calculate the future value of Faisal's investment after the 16th deposit, we can use the future value formula for compound interest, which is given by:\n\n$FV = P * \\frac{(1+r)^n - 1}{r}$\n\nWhere:\n\n*   $FV$ is the future value of the annuity\n*   $P$ is the annual payment (deposit amount)\n*   $r$ is the interest rate per compounding year (as a decimal)\n*   $n$ is the total number of deposits\n\nIn this case:\n\n*   $P = 3090$ (annual deposit)\n*   $r = 0.033$ (3.3% interest rate as a decimal)\n*   $n = 16$ (16 deposits)\n\nNow, plug these values into the formula:\n\n$FV = 3090 * \\frac{(1 + 0.033)^{16} - 1}{0.033}$\n\n$FV = 63779.93$\n\nFinal answer: There is 63,779.93 USD in the account immediately after the 16th deposit.\n""",No Error,clp0q94z100fa1apggtopa1d9,65414aaab70a41e7c12761fa,Economics Single Turn 
,654e7177496086e59618971b,"""Bureaucrats have the ability to set the agenda when it comes to public policy and government spending, which can often result in more spending than voters or legislators desire. One way bureaucrats use their power to set the agenda is by framing issues in a way that favors their preferred policies. For instance, a bureaucrat advocating for more spending on education might frame the issue as a moral imperative to invest in the future of our children, making it difficult for voters or legislators to argue against. Another way bureaucrats can use their power is by controlling the flow of information. By selectively presenting information that supports their preferred policies and using complex language and technical jargon, they can make it difficult for non-experts to understand and make informed decisions.\n\nHowever, several factors limit the power arising from agenda-setting:\n\n*   Checks and balances: democratic systems often have checks and balances in place, including oversight mechanisms, independent evaluations, and legislative scrutiny. These mechanisms aim to secure that decisions are not unduly influenced by a single group, including bureaucrats. \n*   Media and public opinions: The media plays a crucial role in shaping public opinion. If the media provides diverse perspectives and scrutinizes proposed spending, it can counterbalance the agenda-setting power of bureaucrats. Public awareness and engagement also play a role in influencing decision-makers.\n*   Political opposition: Opposition parties and politicians can actively challenge the agenda set by bureaucrats. This creates dynamic political environment where different perspectives are considered, and alternatives are brought to the forefront.\n\nFinal answer: Bureaucrats have the power to set the agenda when it comes to public policy and government spending, but their power is limited by several factors, including oversight by checks and balances, media and public opinion and political opposition etc.\n""",No Error,clp0q95lu00t81apm7avy8x94,65414aaab70a41e7c12761fa,Economics Single Turn 
,654e7185fbdc67d3474c8ec6,"""Nominal GDP is the total value of goods and services produced within a country in a year, at current prices. Real GDP is the same but calculated using constant prices, usually set at a specific year's level, such as 2020.\n\nWe need to calculate Nominal GDP and Real GDP for Economy X in 2020 and 2021 based on bread and butter production data. To calculate Nominal GDP in 2020, we add the total revenue of bread and butter produced.\n\nNominal GDP in 2020 = (250,000 x 0.90) + (200,000 x 2.50) = 725,000\n\nSimilarly, to calculate Nominal GDP in 2021, we multiply the quantity of bread produced (230,000 units) by its price (1.20) and add it to the quantity of butter produced (180,000 units) multiplied by its price (2.90), which gives us:\n\nNominal GDP in 2021 = (230,000 x 1.20) + (180,000 x 2.90) = 798,000\n\nFinal Answer: For calculating Real GDP in 2020, we use the base year 2020 prices.\n""",No Error,clp0q96hf005w1arwdhef7l4q,65414aaab70a41e7c12761fa,Economics Single Turn 
,654e717d4abbda122432c720,"""The Law of One Price states that in efficient markets, identical goods should have the same price in different countries when expressed in a common currency. The Big Mac index, developed by The Economist, uses the price of a McDonald's Big Mac as a standard product available globally to compare purchasing power between countries.\n\nIn this scenario, we have two prices for a Big Mac: \\$5 in the United States and 20 yuan in China. To find the exchange rate that equalizes the price of a Big Mac in both countries, we need to determine how many yuan are equivalent to one US dollar. The calculation is done as follows:\n\n1.  Take the price of a Big Mac in China (20 yuan) and divide it by the price of a Big Mac in the United States (\\$5). This ratio will give us the number of yuan that would equal one US dollar based on the Big Mac prices.\n\n    Calculation:\n\n    Implied Exchange Rate = Price in China (yuan) / Price in USA (dollars) = 20 yuan / 5 dollar = 4 \n2.  Performing this division (20 yuan / 5 dollars) gives us the implied exchange rate under the Law of One Price using the Big Mac index.\n\n    The Law of One Price may not always hold true due to real-world factors such as transportation costs, tariffs, local market conditions, and cultural differences, all of which can lead to price variations for identical goods in different countries.\n\n    Final answer: Based on the Law of One Price and using the Big Mac index, 1 US dollar is equivalent to 4 yuan in China. This calculated exchange rate is a simple way to understand purchasing power and currency value comparison between the two countries.\n\n""",No Error,clp0q97nd00yh1aty17nfexpm,65414aaab70a41e7c12761fa,Economics Single Turn 
,654e715b97d9eb613071ee55,"""Advancements in the automotive industry's production technology, like building new plants, can have notable effects, especially when assuming that the industry operates with zero profit for each firm in the long run.\n\nImagine a scenario where car manufacturers upgrade their production methods, making them more efficient and automated. This often leads to cost savings in making cars. When these savings are passed on to consumers, it means you might see more affordable vehicles in the market. So, the first positive effect is that consumers get better cars at lower prices.\n\nOn the flip side, if all car companies rush to adopt these new technologies and build lots of new plants simultaneously, there could be too many cars flooding the market. This oversupply might force companies to lower prices even more to sell their vehicles. While this can be great for consumers looking for deals, it might hurt the car companies' profits temporarily.\n\nMoreover, building these new high-tech plants creates jobs, not only in the automotive industry but also in the construction and operation of these facilities. This is a positive ripple effect, boosting employment and contributing to economic growth.\n\nFinal answer: While technological progress can make cars better and more affordable, it's crucial for car companies to coordinate their moves to prevent sudden imbalances in the market, ensuring a win-win situation for both the industry and consumers in the long run.\n""",No Error,clp0q98a7029s1asa8e8ze9yj,65414aaab70a41e7c12761fa,Economics Single Turn 
,654e717f3586a310b565926e,"""Economies of scope occur when producing multiple products together is less expensive than producing them separately. To determine if it exists, we compare the cost of producing both products together with the cost of producing each product separately.\n\nLet's analyze the given options:\n\nOption A: The cost of producing Product A and Product B together is the same as the cost of producing them separately. Thus, there are economies of scope in option A.\n\nOption B: Producing Products A and B together is USD 260 which is costlier than making them separately (USD 100 + USD 150 = USD 250). Hence, option B doesn't save anything.\n\nOption C: Producing Products A and B together costs more than making them separately. Therefore, option C doesn't show economies of scope.\n\nOption D: Making Products A and B together costs more than producing them separately, so Option D does not show economies of scope.\n\nFinal answer: Option A is the only one that exhibits economies of scope. This means that producing Product A and Product B together is cheaper than producing them separately.\n""","Error: ""Option A: The cost of producing Product A and Product B together is the same as the cost of producing them",clp0q990m00ym1atybiu352s8,65414aaab70a41e7c12761fa,Economics Single Turn 
,654e7180d2f20fddeccec6a3,"""The RPT (rate of product transformation) is a measure of the rate at which one type of good can be converted into another. \n\nIt is calculated as the ratio of the change in quantity of one good to the change in quantity of another good. The RPT is a positive value that represents the increase in the quantity of one good that can be produced for each unit of the other good that is sacrificed.\n\nThe RPT is not the same as the slope of the production possibility frontier (PPF).\n\nThe slope of the PPF represents the opportunity cost of producing one good in terms of the other. \n\nThe opportunity cost can be positive or negative, depending on the shape of the PPF.\n\nRPT is defined as the ratio of change in quantity in 1 good in response to the change in quantity demanded of other good. For example, if the quantity of good X increases by 2 units and the quantity of good Y decreases by 1 unit, the RPT would be 2/1 = 2. This means that for every unit of good Y that is sacrificed, 2 units of good X can be produced.\n\n**Final answer:**  The RPT is a positive value that measures the rate at which one good can be converted into another, while the slope of the PPF represents the opportunity cost of producing one good in terms of the other. The RPT can only be positive, whereas the slope of the PPF can be either positive or negative.\n""",No Error,clp0q9a9900q71arochwbdus2,65414aaab70a41e7c12761fa,Economics Single Turn 
,654e7181be310f2812e1a864,"""The correct answer is an increase in the capital stock. \n\nExplanation:\n\nAn increase in the capital stock refers to the accumulation of physical capital, such as machinery, equipment, and infrastructure, in an economy. When the capital stock increases, it provides workers with better tools and technology, which can enhance their productivity and output. With improved capital equipment, workers can produce more goods or services in the same amount of time, leading to higher labor productivity.\n\nThe other options that are not directly related to labor productivity:\n\n1.  Increases in the interest rate primarily affect borrowing costs and the cost of capital for businesses, and do not directly impact labor productivity.\n2.  Decreases in the rate of investment can potentially limit improvements in labor productivity, but the impact depends on the specific circumstances.\n3.  Increases in the budget deficit can stimulate economic activity and create jobs, but its impact on labor productivity is indirect and depends on how the spending is allocated.\n4.  Increases in consumption spending can boost economic growth, but do not directly impact labor productivity.\n\nTherefore, of the options provided, an increase in the capital stock is the most likely to enhance labor productivity.\n\nFinal answer: The correct response is: An increase in the capital stock.\n""",No Error,clp0q9au2029y1asa1n6r8agf,65414aaab70a41e7c12761fa,Economics Single Turn 
,654e7184f544d9e399e5e34b,"""A corporation is a state-chartered entity that is legally separate from its owners. Unlike other forms of business entities, a corporation is considered a legal person with its own responsibilities and rights. This legal separation means that corporations can engage in various activities, such as entering contracts, paying taxes, borrowing money, and hiring employees. They can be formed by a group of individuals or a single person, and many large businesses fall under the category of corporations.\n\nOne crucial feature of a corporation is limited liability. This means that the personal assets of shareholders are protected in case the corporation faces debts or liabilities. Shareholders' potential losses are limited to the amount they have invested in the corporation. For example, if you own shares in a corporation and it faces financial trouble, your personal assets are generally shielded.\n\nCorporations, as separate legal entities, can sue and be sued, own property, and enter into contracts independently. This separation provides a layer of protection for shareholders, enhancing the appeal of this business structure.\n\nExamples of well-known corporations include Coca-Cola, Microsoft, and Apple. These entities operate with the primary goal of maximizing shareholder value, and they are overseen by a board of directors elected by the shareholders. The board is responsible for crucial decisions regarding the corporation's operations, finances, and overall strategy.\n\nFinal answer: Option A corporation is the correct answer. So, whether it's Coca-Cola, Microsoft, or Apple, these are all examples of corporations with the added benefit of limited liabilities. It's like having a financial shield, protecting shareholders' personal assets in times of corporate challenges.\n""",No Error,clp0q9bed00qc1aroczjudne5,65414aaab70a41e7c12761fa,Economics Single Turn 
,654e71846d6a0ea870401e76,"""Sure, let me explain in simple words,\n\n\n\nFinal answer: **A) refers to the collective behavior of all buyers.**\n\nAggregate demand represents the total demand for goods and services within an economy from all sources—consumers, businesses, government, and foreign buyers. It's not directly influenced by aggregate supply, but rather represents the total quantity of goods and services demanded at different price levels within an economy. Also, it typically decreases when the price level increases, which goes against option d.\n\n\n\nHope this helps!\n""",No Error,clp0q9c0400ys1atyf31c7qgu,65414aaab70a41e7c12761fa,Economics Single Turn 
,6542d7bd7ff05ecd6d6e4241,"""Sure! I can help you with that!\n\nArticle length doesn't guarantee SEO success. Short articles are reader friendly, but it doesn't guarantee higher search engine rankings. SEO focuses on boosting website visibility in search results, where higher rankings lead to more clicks and views.\n\nWhen it comes to SEO, there are a few key factors that go into how successful a website or content will be in the search engine rankings. These include keywords and keyword phrases, backlinks, content quality, and the structure and design of the website or content. Article length is only one of these factors and does not necessarily determine the success of a website or content in search engine rankings.\nFor example, longer articles may include more in-depth information and cover topics in greater detail, which can be beneficial for SEO. On the other hand, shorter articles may be more concise and easier for readers to digest, but may not include as much detail or cover as many topics.\n\nIn conclusion, in the context of SEO effectiveness, article length is just one factor among many. SEO success relies on various factors like keywords, backlinks, content quality and website structure. While longer articles provide in-depth information and benefit SEO, shorter ones are more reader-friendly. Ultimately, article length is not the sole determinant of a website or content's performance in search engine rankings.\n\nFinal answer: The length of an article does not necessarily affect its SEO. It is possible to create an effective SEO article in any length. The key is to focus on creating content that is relevant, interesting, and optimized for search engines. The correct answer is FALSE.\n\nIf you need more information on the same, please feel free to ask!\n""",No Error,clp0q9cv800yy1atyggvk6reu,65414aaab70a41e7c12761fa,Economics Single Turn 
