project,task_id,response,assessment,reqid,project_id,project_name
,6542d7b0d907688ff77e8a96,"""When the Central Bank maintains a constant money supply, it has distinct effects on output and prices in the short run and the long run, reflecting the complex dynamics of the economy.\n\n*   In the short run, as the money supply remains steady, interest rates experience a decline. This decrease in interest rates makes borrowing more affordable, thereby encouraging both consumers and producers to access additional funds at lower costs. The outcome is a surge in liquidity, resulting in a substantial increase in aggregate demand. Consequently, this surge in demand translates into higher output as businesses ramp up their production to meet the heightened consumer and investment demand. As the supply of goods and services rises in response to the increase in output, prices experience downward pressure. Thus, in the short run, we witness a positive cycle: output increases, while prices decrease.\n*   However, in the long run, the persistent constant money supply, coupled with the continuous increase in demand driven by the enhanced liquidity, can lead to inflation. As businesses face growing demand and increased profits, they gradually start to raise their prices to capitalize on the favorable market conditions, leading to an inflationary trend. In this scenario, inflation becomes a concerning issue, as the value of money diminishes, and the purchasing power of consumers erodes. Consequently, in the long run, prices experience an upward trajectory, and output may stagnate or even decline due to the economic pressures resulting from inflation.\n\nTo summarize, the Central Bank's maintenance of a constant money supply triggers short-term outcomes of increased output and decreased prices. In the long run, however, the situation changes, with rising prices and the possibility of stagnant or declining output due to the pressures of inflation.\n\nFinal answer: Thus, if Central Bank maintains a constant money supply, it results in short-term and long-term effects:\n\n1.  Short Term: In the short term, output increases while prices decrease.\n2.  Long Term: In the long term, prices increase, and output may remain constant or potentially decrease due to inflationary pressures.\n\n""",No Error,clp0q9dpc00tg1apm0n898j75,65414aaab70a41e7c12761fa,Economics Single Turn 
,6542d7b8af2419dc8e2efee6,"""**Improved Student's Answer:**\nIn the short run, a purely competitive firm can earn an above-normal profit due to various factors such as high demand, limited supply, or entry barriers. However, in the long run, the scenario changes as the firm's above-normal profit attracts new entrants into the market. The entry of new firms increases the industry's supply, which lowers the market price and reduces the profit margin for each firm. This process continues until the profit margin returns to zero, and the firm can only break even.\n\nThe entry of new firms is driven by the prospect of earning supernormal profits. As the incumbent firm enjoys above-normal profits, potential entrants are incentivized to enter the market and capture a share of the profits. The new firms bring additional capacity, which increases the industry's supply. As the supply increases, the market price begins to fall, and the profit margin of each firm starts to decrease.\n\nThe reduction in profit margin continues until the point where the firms can only break even. At this point, the firms have reached their minimum efficient scale, which means that they are producing at the lowest possible cost. Any further increase in production would result in higher costs, making it unprofitable for the firms to operate. Therefore, in the long run, the firms will operate at their minimum efficient scale, and the profit margin will be zero.\n\nIn conclusion, the purely competitive firm cannot earn an above-normal profit in the long run due to the entry of new firms, which increases the industry's supply, lowers the market price, and reduces the profit margin. The process continues until the firms can only break even, and the market reaches a state of perfect competition.\n\nFinal answer summarizing the response: In the long run, the entry of new firms in a purely competitive market drives down the market price and profit margin, causing the firms to operate at their minimum efficient scale and break even..</s>""",No Error,clp0q9edh00tm1apm9skp6kav,65414aaab70a41e7c12761fa,Economics Single Turn 
,654e718419d3e36ba64c420b,"""The multiplier of 9 reveals the ratio of the marginal propensity to consume (MPC) to the marginal propensity to save (MPS).\n\nSince MPC + MPS = 1, we can rewrite the equation as:\n\nMPC = (1- MPS) / MPS\n\nSubstituting the value of the multiplier, we get:\n\nMPC = (1-0.89) / 0.89 = 0.11\n\nTherefore, the MPC is 0.11 and the MPS is 0.89\n\n**Final answer:** The MPS is 0.89, and the MPC is 0.11, as determined by the multiplier of 9, which represents the ratio of the marginal propensity to save (MPS) to the marginal propensity to consume (MPC).\n""","Error: ""The multiplier of 9 reveals the ratio of the marginal propensity to consume (MPC) to the marginal propensity",clp0q9f9200561as59m5fatwy,65414aaab70a41e7c12761fa,Economics Single Turn 
,6542d7baf40c3b141068a2f4,"""For a firm in monopolistic competition, the market equilibrium is achieved when the firm maximizes its profits by producing the quantity where the marginal revenue (MR) equals the marginal cost (MC). This is because, in a monopolistically competitive market, firms have some degree of market power, allowing them to influence prices and affect the market demand curve. However, the firms also face competition from other firms producing similar products, which prevents them from charging arbitrary prices and ensures that the price is based on the average return (AR) curve.\n\nTherefore, the correct response is: C) MR = MC.\n\nIn addition, for a firm in monopolistically competitive market equilibrium, following conditions must be met:\n\n*   MC ≥ AC: In a monopolistically competitive market, firms have some degree of market power, which allows them to charge prices that exceed their average cost (AC). The excess of price over AC represents the profit that the firm earns. Thus, the marginal cost (MC) of producing\n*   MR ≤ AR: The marginal revenue (MR) is the revenue that the firm earns from selling one more unit of the product. The average revenue (AR) is the total revenue that the firm earns from selling all the units it produces. Since the firm faces a downward-sloping demand curve, the MR should be less than or equal to AR to ensure that the firm is not losing money on any additional units sold.\n*   P ≥ AC: The price (P) charged by the firm must be greater than or equal to the average cost (AC) to ensure profitability.\n\n    In conclusion, for a firm to be profitable in a monopolistic competition, the equilibrium is determined where marginal revenue equates with marginal cost. At this point, the MC should be greater than or equal to AC, while the MR should be less than or equal to AR and Price should be more than or equal to the average cost.\n\nFinal answer summarizing the response:\nIn a monopolistically competitive market, the equilibrium is achieved when the firm produces the quantity where MR = MC. The other parts of the question can be addressed by understanding the relationships between MR, AR, and AC. The firm aims to maximize its profits, which ensures that the price is greater than or equal to AC, and MR ≤ AR.\n""",No Error,clp0q9gkw02981aqibwrh0ao0,65414aaab70a41e7c12761fa,Economics Single Turn 
,6542d7ba32b1c39374abdda9,"""Based on the information provided, Veronica may have a case for negligence against the cleaner or the entity that employs the cleaner. In a negligence claim, Veronica would need to prove four elements:\n\n1.  **Duty of Care**: The cleaner or their employer had a duty of care to ensure that the public toilet was safe for use. This includes checking if the toilet is occupied before locking it.\n2.  **Breach of Duty**: The cleaner breached this duty of care by locking the toilet door without checking if it was occupied.\n3.  **Causation**: This breach of duty caused Veronica to be locked in the toilet and subsequently injured when she tried to climb out.\n4.  **Damage**: Veronica suffered actual harm or injury as a result of this breach.\n\nHowever, the cleaner or their employer may argue contributory negligence on Veronica’s part. **Contributory negligence** is a defense that argues that the plaintiff contributed to their injury. In this case, they might argue that Veronica contributed to her injury by attempting to climb over the partition wall instead of calling for help or waiting for someone to unlock the door.\n\nVeronica has several legal options available to her. She could file a personal injury claim against the cleaner and the institution, seeking compensation for her injuries. She could also report the incident to the relevant authorities, such as the local health and safety executive.\n\n**Final Answer:** Veronica has a valid claim against the cleaner and the institution and has a strong case for seeking compensation for her injuries. She should gather evidence, such as witness statements and medical records, to support her claim. She should consult a personal injury lawyer to help her navigate the legal process and ensure that she receives fair compensation for her injuries.\n""",No Error,clp0q9h8002w91as68djc60hu,65414aaab70a41e7c12761fa,Economics Single Turn 
,654e7185f544d9e399e5e428,"""When an individual transfers money from a demand deposit account to a small-denomination time deposit, it will affect the M1 and M2 measures of money supply differently.\n\nM1, also referred to as the narrow money supply, comprises currency in circulation, demand deposits, and other liquid assets that can be effortlessly converted into cash. When an individual transfers money from a demand deposit to a time deposit, the demand deposit component of M1 is reduced, and as a result, M1 also decreases by the same amount.\n\nOn the other hand, M2 also referred to as the broad money supply, is comprised of M1, savings deposits, time deposits, and other liquid assets that can be easily converted to cash within a short period of time. When a transfer is made from a demand deposit account to a time deposit account, the total amount of time deposits will increase by the same amount transferred. However, since M2 includes both M1 and time deposits, the increase in time deposits will balance out the decrease in demand deposits, resulting in no net change in the M2 money supply.\n\nFinal answer: The movement of money from a demand deposit account to a small-denomination time deposit will result in a decrease in M1 and no change in M2.\n""",No Error,clp0q9hum00tr1apm1sbf2ktv,65414aaab70a41e7c12761fa,Economics Single Turn 
,654e7187a3633932f3bb6e39,"""Differentiated products are goods or services with unique attributes that distinguish them from others in the market. The following factors can contribute to trade in differentiated products:\n\na. Transportation cost: Transportation cost can impact the price of differentiated products sold in different locations. For example, the cost of transporting high-demand software can affect its price and the profit margin of the producer. Thus, transportation cost affects trade in differentiated products by influencing their price and profitability.\n\nb. Technological dissemination: Tech dissemination spreads innovation and boosts productivity and quality of goods, fostering trade in differentiated products. For example, a company that produces high-quality smartphones with advanced features can differentiate its products from those of its competitors by investing in research and development to improve the quality and functionality of its products.\n\nc. Imperfect competition: Imperfect competition is when companies sell different products or services and set their own prices. They differentiate themselves by offering unique features, better quality, or additional services. For example, a company that sells customized clothing can stand out by offering tailor-made clothing that meets specific needs and preferences.\n\nFinal answer: Differentiated products have unique features or attributes that distinguish them from others in the market. Transportation costs, technological dissemination, and imperfect competition can contribute to trade in differentiated products by influencing their price, quality, and uniqueness. Therefore, the answer is option d, all of the above.\n""","Error: ""For example, the cost of transporting high-demand software can affect its price and the profit margin of the producer.""",clp0q9ig602we1as6994k20qo,65414aaab70a41e7c12761fa,Economics Single Turn 
,654e71813cc184dd90aa5abb,"""Our objective is to identify the most suitable machine among the different ME alternatives based on the PW analysis, considering a fixed interest rate of 10%. For this purpose, we will evaluate the present worth (PW) of each machine and compare the results to make an informed decision.\n\nThe PW of Machine A can be calculated as follows:\n\nPW of Machine A = Present worth of cost - Present worth of Benefits\nPW of Machine A = $20,914 + $9,480(P/A,10,3) - \\$4,000(P/F,10,3)\n\nUsing the DCIF tables, we get:\n\nPW of Machine A = $20,914 + $9,480(2.487) - 4,000(0.7513) PW of Machine A= 20,914 + $23,358.40 - $3,004.20\nPW of Machine A = \\$41,268.20\n\nMachine A has a positive PW of \\$41,268.20, indicating it is economically viable and meets the requested MARR.\n\nFinal answer: The interest rate is the cost of borrowing money, expressed as a percentage of the loan amount. PW of Machine A = \\$41268.20\n""",No Error,clp0q9jtd02wj1as6hz5ode1g,65414aaab70a41e7c12761fa,Economics Single Turn 
,6542d7bbaf2419dc8e2eff9b,"""**Improved answer:**\n\nThe migration of highly skilled white-collar jobs from developed-world firms to less developed economies has both winners and losers. The high skilled workers who migrate to LDCs will benefit from higher wages compared to their counterparts in the developed countries. They will also have better job opportunities and a higher standard of living. On the other hand, the developed-world firms also gain from this migration as they can take advantage of lower labor costs in the LDCs.\n\nHowever, there are also losers in this scenario. The low skilled workers in the less developed countries will see their jobs substituted by the high skilled workers who have migrated. They will not only suffer from job loss but also from lower wages as they are not eligible for the high skilled jobs. Additionally, the high skilled workers in the developed countries who lose their jobs due to outsourcing will also be worse off.\n\nIn conclusion, the migration of highly skilled white-collar jobs to less developed economies results in a mixed outcome. While the high skilled workers and developed-world firms benefit from this migration, the low skilled workers in the less developed countries and high skilled workers in the developed countries are negatively affected. Therefore, it is essential to consider the potential impacts of outsourcing on all parties involved.\n\nFinal answer summary: The migration of highly skilled white-collar jobs to less developed economies benefits high skilled workers and developed-world firms, but negatively affects low skilled workers in the less developed countries and high skilled workers in the developed countries..</s>""",No Error,clp0q9keo00tw1apm9u4kax70,65414aaab70a41e7c12761fa,Economics Single Turn 
,654e71813cc184dd90aa5ab9,"""Yes, Peter can recover the cost of painting Nalini's house under the theory of unjust enrichment or quasi-contract. Unjust enrichment is a legal principle that prohibits one person from benefiting at the expense of another without a legal foundation. In this case, Nalini benefited from Peter's services when he painted their house, but they did not pay for them. This is unfair enrichment, and Peter is entitled to reimbursement for his services.\n\nMoreover, under the notion of quasi-contract, Peter may be able to recoup the cost of painting Nalini's house. A quasi-contract is a legal notion that allows a court to impose a contract on the parties even if they did not agree to it. In this situation, a court may rule that Nalini owed Peter money for his services even though they did not enter into an explicit contract. Nalini knew Peter was painting their house and that they would profit from his services.\n\nTo calculate the cost of painting Nalini's house, Peter can provide evidence of the cost of materials, labor, and any other expenses incurred during the painting process. He can also present evidence of the value that Nalini received from the improved appearance and increased property value of their house.\n\n**Final answer:** Peter may potentially recover the \\$5,000 from Nalini if there was a clear agreement, either written or verbal, for the painting job. This could be pursued through a breach of contract claim. If no such agreement exists, recovering the money might be more challenging and the outcome could depend on the specific details and laws in their jurisdiction. Consulting with a legal professional is essential to determine the best course of action in this situation. Legal outcomes can vary based on the specific facts and laws involved.\n""",No Error,clp0q9l1900u11apm62su6sqv,65414aaab70a41e7c12761fa,Economics Single Turn 
,6542d7ba0767d6755c70410c,"""Suppose an upstream supplier becomes more profitable. Then:\n\nOption C is correct. Acquiring it will make you more profitable as you can charge a higher price due to complementarity.\n\nExplanation: When the upstream supplier becomes more profitable by charging higher prices for their raw materials, it creates an opportunity for the firm to also increase its prices. The firm can do this because the raw materials they receive from the supplier are now more valuable, and the firm can pass on the increased cost to their customers. This is known as complementarity, where the value of the raw materials and the final product are closely linked. In this case, the upstream supplier's product is complementary to the firm's product, which means that the firm's product becomes more valuable when used with the upstream supplier's product.\n\nAs a result, the firm can charge a higher price for their product, increasing their profitability.\n\nTherefore, the correct response would indeed be, option C.\n\nFinal answer summary: Acquiring an upstream supplier that becomes more profitable can increase the firm's profitability due to complementarity, which allows the firm to charge higher prices for their product.\n""",No Error,clp0q9lnr00651arw3vjq1chl,65414aaab70a41e7c12761fa,Economics Single Turn 
,654e718126e51716863bdd53,"""The zero-coupon bond has a face value of $110 and matures in 1 year. It trades at a price of $100. To calculate the yield to maturity (YTM), we use the formula: YTM = (f/p)^(1/n) - 1, where f = face value, p = purchase price, and n = year to maturity.\n\nPlugging in the values, we get:\nYTM = ($110/$100)^(1/1) - 1\nYTM = 1.1 - 1\nYTM = 0.1\n\nTo convert YTM to percentage, we multiply it by 100:\nYTM = 0.1 \\* 100%\nYTM = 10%\n\nTherefore, the yield to maturity of the zero-coupon bond is 10%.\n\n**Final answer:** (D) 10%.\n\nThe improved answer is more concise and avoids repetition of the formula. It also uses the same formula to convert YTM to percentage, making it easier to understand. The explanation is clear and well-structured, and the concept is well-understood.\n""",No Error,clp0q9mfm00qi1aro88k0g1o9,65414aaab70a41e7c12761fa,Economics Single Turn 
,6542d7b93e915183a47f4a24,"""**Improved answer:** A free trade area (FTA) is a unique economic arrangement among member nations that offers distinct advantages over other trade agreements. Unlike a customs union, an FTA has no tariffs on trade among member nations and a common set of tariffs on imports from non-members. Additionally, member nations maintain independence to impose restrictions on imports from non-member countries.\n\nOne of the key features of an FTA is the free mobility of factors of production such as labor and capital among members. This allows for greater economic integration and cooperation among member nations, leading to increased economic efficiency and growth.\n\nWhile an FTA is similar to a customs union in that they both have a common external tariff for non-members on imported and exported goods, an FTA differs in that it does not require member nations to have a common commercial policy towards non-members. This allows member nations to maintain their independence in setting trade policies with non-member countries.\n\nIn summary, an FTA is unique in that it offers a combination of no tariffs on trade among member nations, a common set of tariffs on imports from non-members, and free mobility of factors of production such as labor and capital among members. This makes it an attractive option for countries looking to promote economic integration and cooperation.\n\nFinal answer: An FTA is unique in that it offers a combination of no tariffs on trade among member nations, a common set of tariffs on imports from non-members, and free mobility of factors of production such as labor and capital among members.\n\nThe improved answer addresses the prompt fully and provides a clear and concise explanation of the unique features of an FTA. It also uses proper terminology and avoids repetition, making it easier to understand and more informative..</s>""","Error: ""Unlike a customs union, an FTA has no tariffs on trade among member nations and a common set of tariffs",clp0q9n8204vz1as39kl06mfn,65414aaab70a41e7c12761fa,Economics Single Turn 
,654e715d97d9eb613071ef2c,"""The COVID-19 pandemic has worsened the pre-existing wealth gap in America, leaving many struggling to get by while the rich get richer. The topic of taxes on the wealthy has been a subject of debate for a long time, but it's important to consider what actually constitutes wealth in America. Although taxes may impact the middle class more than the super-rich, it's crucial to focus on the ultra-wealthy individuals who earn millions of dollars each year, such as Lebron James and Kylie Jenner.\n\nIncreasing taxes on the ultra-wealthy may aid in reducing income inequality and redistributing wealth. However, it is crucial to recognize that certain affluent individuals, such as Lebron James, do participate in philanthropy and contribute to their communities. This emphasizes the importance of finding a balance between taxing the rich and promoting charitable giving.\n\nProviding tax relief for charitable donations could be a potential solution for incentivizing the wealthy to give back while still supporting the government's revenue. Such an approach could help reduce the impact of higher taxes on the super-rich and promote greater social welfare.\n\nFinal answer: The COVID-19 pandemic has intensified the issue of income inequality in America. Although there are some arguments against increasing taxes on the wealthy, adopting a balanced approach that includes tax relief for charitable donations could be a viable solution to mitigate income inequality and promote greater social welfare.\n""",No Error,clp0q9oyh04w41as395k9ge95,65414aaab70a41e7c12761fa,Economics Single Turn 
,654e718426e51716863bdf0d,"""Inaccurate content in text produced from recorded notes can have several consequences:\n\n1.  **Miscommunication and Misinformation**: The primary purpose of notes is to accurately record information for future reference. If the content is inaccurate, it can lead to misunderstandings and miscommunication. For instance, if a student inaccurately transcribes a lecture, they may misunderstand the material and perform poorly on an exam.\n2.  **Loss of Trust**: Inaccurate content can lead to a loss of trust in the source of the information. This is particularly important in professional settings where accuracy is paramount. In a business setting, if a meeting’s minutes are inaccurately recorded, stakeholders may lose trust in the company’s ability to accurately report information.\n3.  **Decision-making Impact**: Decisions are often made based on the information available at the time. If this information is inaccurate, it can lead to poor or incorrect decisions. For example, in a medical context, if a doctor’s notes about a patient’s symptoms are inaccurate, it could lead to incorrect diagnosis and treatment.\n4.  **Legal Implications**: In some cases, inaccurate information can have legal implications. In a court of law, if a lawyer inaccurately records information from a client, it could lead to misrepresentation of facts and potentially impact the outcome of a case.\n5.  **Damage to Reputation**: Inaccurate content can damage the reputation of an individual or organization. For instance, a journalist who inaccurately transcribes an interview could misquote a source, leading to misinformation and damage to both their reputation and that of their publication.\n\n**Final Answer:** Inaccurate content in transcribed notes can lead to misunderstandings, loss of trust, poor decision making, legal implications, and damage to reputation. Ensuring accuracy can be achieved through careful listening, thorough proofreading, and using professional transcription services when necessary. \n""",No Error,clp0q9pji00u81apmabpo8qus,65414aaab70a41e7c12761fa,Economics Single Turn 
